belongs_to_collection,genres,id,imdb_id,original_language,original_title,overview,popularity,poster_path,production_companies,release_date,revenue,runtime,status,tagline,title,vote_average,vote_count,backdrop_path
"{'id': 386534, 'name': '... Has Fallen Collection', 'poster_path': '/kM0U7nzdSepUkC6sOvVrqZkdFk5.jpg', 'backdrop_path': '/w5GjGycHi5EOfPx2JSMshCN7OJn.jpg'}","[{'id': 28, 'name': 'Action'}, {'id': 53, 'name': 'Thriller'}]",117263,tt2302755,en,Olympus Has Fallen,"When the White House (Secret Service Code: ""Olympus"") is captured by a terrorist mastermind and the President is kidnapped, disgraced former Presidential guard Mike Banning finds himself trapped within the building. As the national security team scrambles to respond, they are forced to rely on Banning's inside knowledge to help retake the White House, save the President and avert an even bigger disaster.",10.978188,/l542hLtKhsmOWEBFoC7Aajk0nKt.jpg,"[{'name': 'Nu Image Films', 'id': 925}, {'name': 'Millennium Films', 'id': 10254}]",2013-03-20,161025640.0,120.0,Released,When our flag falls our nation will rise.,Olympus Has Fallen,6.2,3010.0,/w5GjGycHi5EOfPx2JSMshCN7OJn.jpg
"{'id': 131292, 'name': 'Iron Man Collection', 'poster_path': '/fbeJ7f0aD4A112Bc1tnpzyn82xO.jpg', 'backdrop_path': '/rI8zOWkRQJdlAyQ6WJOSlYK6JxZ.jpg'}","[{'id': 28, 'name': 'Action'}, {'id': 12, 'name': 'Adventure'}, {'id': 878, 'name': 'Science Fiction'}]",68721,tt1300854,en,Iron Man 3,"When Tony Stark's world is torn apart by a formidable terrorist called the Mandarin, he starts an odyssey of rebuilding and retribution.",23.721243,/1Ilv6ryHUv6rt9zIsbSEJUmmbEi.jpg,"[{'name': 'Marvel Studios', 'id': 420}]",2013-04-18,1215439994.0,130.0,Released,Unleash the power behind the armor.,Iron Man 3,6.8,8951.0,/rI8zOWkRQJdlAyQ6WJOSlYK6JxZ.jpg
"{'id': 86119, 'name': 'The Hangover Collection', 'poster_path': '/aMmNLuyXvdBih1R5RRHtdtNaS6N.jpg', 'backdrop_path': '/uEtsf26a9RsRDy85MOIv1xAj44x.jpg'}","[{'id': 35, 'name': 'Comedy'}]",109439,tt1951261,en,The Hangover Part III,"This time, there's no wedding. No bachelor party. What could go wrong, right? But when the Wolfpack hits the road, all bets are off.",25.085639,/vtxuPWkdllLNLVyGjKYa267ntuH.jpg,"[{'name': 'Legendary Pictures', 'id': 923}, {'name': 'Green Hat Films', 'id': 3527}]",2013-05-23,362000072.0,100.0,Released,It all ends.,The Hangover Part III,6.0,2991.0,/uEtsf26a9RsRDy85MOIv1xAj44x.jpg
"{'id': 382685, 'name': 'Now You See Me Collection', 'poster_path': '/n0ygWnRip5RYnejdI6Lpwxov0x7.jpg', 'backdrop_path': '/scBzORmLqP00h8hPKS19TLtyRQm.jpg'}","[{'id': 53, 'name': 'Thriller'}, {'id': 80, 'name': 'Crime'}]",75656,tt1670345,en,Now You See Me,An FBI agent and an Interpol detective track a team of illusionists who pull off bank heists during their performances and reward their audiences with the money.,17.852022,/A06e9YJ5ry3WXEIFIAD1mKBxcuZ.jpg,"[{'name': 'Summit Entertainment', 'id': 491}, {'name': 'K/O Paper Products', 'id': 7296}, {'name': 'SOIXAN7E QUIN5E', 'id': 23271}, {'name': 'See Me Louisiana', 'id': 23272}]",2013-05-29,117698894.0,115.0,Released,4 amazing magicians. 3 impossible heists. 1 billion dollars. This is no illusion.,Now You See Me,7.3,5635.0,/scBzORmLqP00h8hPKS19TLtyRQm.jpg
"{'id': 209131, 'name': 'Man of Steel Collection', 'poster_path': '/rNnIW6xSPeTiIUtsfEhFeIRiJVv.jpg', 'backdrop_path': '/csERw2A3XIsGegkzil6UGpyhqfw.jpg'}","[{'id': 28, 'name': 'Action'}, {'id': 12, 'name': 'Adventure'}, {'id': 14, 'name': 'Fantasy'}, {'id': 878, 'name': 'Science Fiction'}]",49521,tt0770828,en,Man of Steel,"A young boy learns that he has extraordinary powers and is not of this earth. As a young man, he journeys to discover where he came from and what he was sent here to do. But the hero in him must emerge if he is to save the world from annihilation and become the symbol of hope for all mankind.",18.538834,/xWlaTLnD8NJMTT9PGOD9z5re1SL.jpg,"[{'name': 'Legendary Pictures', 'id': 923}, {'name': 'Warner Bros.', 'id': 6194}, {'name': 'DC Entertainment', 'id': 9993}, {'name': 'Syncopy', 'id': 9996}, {'name': 'Cruel and Unusual Films', 'id': 78685}]",2013-06-12,662845518.0,143.0,Released,You will believe that a man can fly.,Man of Steel,6.5,6462.0,/csERw2A3XIsGegkzil6UGpyhqfw.jpg
"{'id': 86066, 'name': 'Despicable Me Collection', 'poster_path': '/xIXhIlZDRmSSfNbpN7kBCm5hg39.jpg', 'backdrop_path': '/15IZl405E664QDVxpFJBl7TtLmw.jpg'}","[{'id': 16, 'name': 'Animation'}, {'id': 35, 'name': 'Comedy'}, {'id': 10751, 'name': 'Family'}]",93456,tt1690953,en,Despicable Me 2,Gru is recruited by the Anti-Villain League to help deal with a powerful new super criminal.,24.82355,/kQrYyZQHkwkUg2KlUDyvymj9FAp.jpg,"[{'name': 'Universal Pictures', 'id': 33}, {'name': 'Illumination Entertainment', 'id': 6704}]",2013-06-25,970761885.0,98.0,Released,Back 2 Work,Despicable Me 2,7.0,4729.0,/15IZl405E664QDVxpFJBl7TtLmw.jpg
"{'id': 44913, 'name': 'Ghoulies Collection', 'poster_path': '/1fi1IXm3igboWBjrnyWQnvwsmLC.jpg', 'backdrop_path': '/h9pZnjShhHf5h9MaEWg2RPkrgsf.jpg'}","[{'id': 14, 'name': 'Fantasy'}, {'id': 18, 'name': 'Drama'}, {'id': 27, 'name': 'Horror'}, {'id': 28, 'name': 'Action'}, {'id': 35, 'name': 'Comedy'}]",44909,tt0097429,en,Ghoulies III: Ghoulies Go to College,"A college teacher brings the little creatures back to his campus, where they proceed to terrorize the faculty and students.",1.540257,/x7Zt73obslWWT2uLs1SpHoukEd7.jpg,"[{'name': 'Taurus Entertainment Company', 'id': 4824}, {'name': 'Vestron Pictures', 'id': 12360}]",1991-09-18,0.0,94.0,Released,Everybody's favorite troublemakers are on the loose again!,Ghoulies III: Ghoulies Go to College,3.9,22.0,/h9pZnjShhHf5h9MaEWg2RPkrgsf.jpg
"{'id': 188458, 'name': 'Trilogy of Terror Collection', 'poster_path': '/902guxiZSBjJfCNPc0lC8Rd1j9r.jpg', 'backdrop_path': '/uocSoHqQbbt1S5Zo93Vb03l5JU3.jpg'}","[{'id': 27, 'name': 'Horror'}, {'id': 53, 'name': 'Thriller'}]",45875,tt0117966,en,Trilogy of Terror II,"Three tales of terror: in ""The Graveyard Rats"" lovers murder the woman's older husband and encounter horror when they attempt to rob his grave; ""Bobby"" is the story of a woman who summons her son back from the dead; and in ""He Who Kills"" an African doll goes on a murderous rampage.",1.15884,/5QFPqKCyYMIKvujRIJzFJ5LlwNs.jpg,[],1996-10-30,0.0,90.0,Released,,Trilogy of Terror II,5.8,9.0,/uocSoHqQbbt1S5Zo93Vb03l5JU3.jpg
"{'id': 453993, 'name': 'The Wolverine Collection', 'poster_path': '/8Ht4a5A5Ypxh0PjbVoRTzm1kAu3.jpg', 'backdrop_path': '/QtSxEuCwcZSfCTMZfER3nHDVsG.jpg'}","[{'id': 28, 'name': 'Action'}, {'id': 878, 'name': 'Science Fiction'}, {'id': 12, 'name': 'Adventure'}, {'id': 14, 'name': 'Fantasy'}]",76170,tt1430132,en,The Wolverine,"Wolverine faces his ultimate nemesis - and tests of his physical, emotional, and mortal limits - in a life-changing voyage to modern-day Japan.",3.918287,/iTST6DcLhfufWYUKCOskkusaYUq.jpg,"[{'name': 'Twentieth Century Fox Film Corporation', 'id': 306}, {'name': ""Donners' Company"", 'id': 431}, {'name': 'Marvel Entertainment', 'id': 7505}, {'name': 'Bad Hat Harry Productions', 'id': 9168}, {'name': 'Big Screen Productions', 'id': 10893}, {'name': 'TSG Entertainment', 'id': 22213}]",2013-07-23,415440673.0,126.0,Released,"When he's most vulnerable, he's most dangerous.",The Wolverine,6.3,4110.0,/QtSxEuCwcZSfCTMZfER3nHDVsG.jpg
"{'id': 343297, 'name': 'My Little Pony: Equestria Girls Collection', 'poster_path': '/4M2ILVXIbwMRWdAlqRRdVLHua4T.jpg', 'backdrop_path': '/xZQpaBH9UOhTx5WWV9ND5mudi1Q.jpg'}","[{'id': 16, 'name': 'Animation'}, {'id': 35, 'name': 'Comedy'}, {'id': 10751, 'name': 'Family'}, {'id': 14, 'name': 'Fantasy'}, {'id': 10402, 'name': 'Music'}]",201676,tt2908228,en,My Little Pony: Equestria Girls,"Via a magic mirror, Twilight Sparkle travels into an alternate universe in order to recover a crown that was stolen from the Crystal Empire. Upon her arrival she is horrified to learn that she has turned into a human.",8.353231,/bt6VDN7vUAzj2h2Qg6Wqj2ucK68.jpg,"[{'name': 'Hasbro', 'id': 2598}, {'name': 'DHX Media', 'id': 7225}]",2013-06-15,0.0,72.0,Released,The magic of friendship never changes.,My Little Pony: Equestria Girls,7.1,41.0,/xZQpaBH9UOhTx5WWV9ND5mudi1Q.jpg
"{'id': 137766, 'name': 'Zapped Collection', 'poster_path': '/tMUYXjDbmThTZWeqsUhiZbNz0OI.jpg', 'backdrop_path': '/fbKtJK0Br7DsG8ueaKPEtaPPG6J.jpg'}","[{'id': 35, 'name': 'Comedy'}]",54768,tt0101005,en,Zapped Again!,"A new kid moves into school, making enemies with the affluent societies and joining the beleaguered Science Club. But when an old potion is discovered to confer telekinetic power he gets the chance to get his own back, as well as having a bit of fun on the side.",0.828592,/jjAR8ZLn6E83XmyXz3zCa2j0xeK.jpg,"[{'name': 'Incorporated Television Company (ITC)', 'id': 15980}, {'name': 'Part II Productions', 'id': 16856}]",1990-04-14,0.0,96.0,Released,Emerson High has raised more than its academic standards.,Zapped Again!,5.2,5.0,/fbKtJK0Br7DsG8ueaKPEtaPPG6J.jpg
"{'id': 259256, 'name': 'Race Collection', 'poster_path': '/AhWQp7QskpVwNjlqNMMBu4FTbaM.jpg', 'backdrop_path': '/6IGJVSafLNIVFUCXnWcrc5NixZQ.jpg'}","[{'id': 18, 'name': 'Drama'}, {'id': 28, 'name': 'Action'}, {'id': 53, 'name': 'Thriller'}, {'id': 80, 'name': 'Crime'}]",19658,tt1017456,en,Race,"Ranvir and Rajiv are half brothers who own a huge stud farm in South Africa. Ranvir is a very shrewd and aggressive man while Rajiv is laid back, and a chronic alcoholic. Sophia, Ranvir's personal secretary adores and loves him. Ranvir is unaware of her feelings. Shaina, an Indian ramp model in Durban loves Ranvir but through a twist of fate gets married to his younger brother Rajiv. When she discovers that Rajiv is a chronic alcoholic, her world is shattered. Ranvir too is disturbed as he has sacrificed his love for his younger brother because Rajiv had promised to leave alcohol for good if he marries Shaina. In a weak moment Ranvir and Shaina come very close to each other. When Rajiv starts suspecting, all hell breaks loose. A murder is committed, a contract killing is issued. A sharp tongued detective R.D., getting wise on the proceedings, starts an intriguing investigation with his brainless bimbo assistant Mini",2.337689,/krMI3hRmlgKcuNc3XBWtl8APasR.jpg,[],2008-03-20,0.0,161.0,Released,Two Brothers... One Plays to Win... One Plays to Defeat,Race,5.8,32.0,/6IGJVSafLNIVFUCXnWcrc5NixZQ.jpg
"{'id': 86024, 'name': 'Legally Blonde Collection', 'poster_path': '/kupFjC97HLSqG5CX47NsTJNEyAs.jpg', 'backdrop_path': '/aabPyPAA6E8hJ7tUipwunr3Itzb.jpg'}","[{'id': 35, 'name': 'Comedy'}]",16985,tt1015999,en,Legally Blondes,"Moving from England to California, the youngest cousins of Elle Woods must defend themselves when their schools reigning forces turn on the girls and try to frame them for a crime.",15.504416,/wZnEw0avASZwBWcJo5F1pdJnmO2.jpg,"[{'name': 'Type A Films', 'id': 2308}, {'name': 'Marc Platt Productions', 'id': 2527}, {'name': 'Brookwell-McNamara Entertainment', 'id': 3235}, {'name': 'Metro-Goldwyn-Mayer (MGM)', 'id': 8411}]",2009-04-28,0.0,86.0,Released,,Legally Blondes,4.4,48.0,/aabPyPAA6E8hJ7tUipwunr3Itzb.jpg
"{'id': 126125, 'name': 'The Expendables Collection', 'poster_path': '/ptF9rVkzoXVO1bnglLISgnJ7Ccr.jpg', 'backdrop_path': '/lA7oDSt6LkyDqtbFGbyuG0afmTI.jpg'}","[{'id': 28, 'name': 'Action'}, {'id': 12, 'name': 'Adventure'}, {'id': 53, 'name': 'Thriller'}]",138103,tt2333784,en,The Expendables 3,"Barney, Christmas and the rest of the team comes face-to-face with Conrad Stonebanks, who years ago co-founded The Expendables with Barney. Stonebanks subsequently became a ruthless arms trader and someone who Barney was forced to kill… or so he thought. Stonebanks, who eluded death once before, now is making it his mission to end The Expendables -- but Barney has other plans. Barney decides that he has to fight old blood with new blood, and brings in a new era of Expendables team members, recruiting individuals who are younger, faster and more tech-savvy. The latest mission becomes a clash of classic old-school style versus high-tech expertise in the Expendables’ most personal battle yet.",14.753545,/xczFwJhcCb2rUMylXam0Ni7Yn5o.jpg,"[{'name': 'Davis-Films', 'id': 342}, {'name': 'Nu Image Films', 'id': 925}, {'name': 'LionsGate', 'id': 7571}, {'name': 'Millennium Films', 'id': 10254}, {'name': 'Ex3 Productions', 'id': 28384}, {'name': 'Fipex Holding', 'id': 40822}]",2014-08-04,206172544.0,127.0,Released,New team. New attitude. New mission.,The Expendables 3,6.1,1830.0,/lA7oDSt6LkyDqtbFGbyuG0afmTI.jpg
"{'id': 295130, 'name': 'The Maze Runner Collection', 'poster_path': '/beR71cbwXH0vySlTMPZo0GQ54Q9.jpg', 'backdrop_path': '/eQ8iwAvGfuNnPjBCKTIVp5PsFw.jpg'}","[{'id': 28, 'name': 'Action'}, {'id': 9648, 'name': 'Mystery'}, {'id': 878, 'name': 'Science Fiction'}, {'id': 53, 'name': 'Thriller'}]",198663,tt1790864,en,The Maze Runner,"Set in a post-apocalyptic world, young Thomas is deposited in a community of boys after his memory is erased, soon learning they're all trapped in a maze that will require him to join forces with fellow ""runners"" for a shot at escape.",76.93789,/coss7RgL0NH6g4fC2s5atvf3dFO.jpg,"[{'name': 'Ingenious Media', 'id': 290}, {'name': 'Twentieth Century Fox Film Corporation', 'id': 306}, {'name': 'Gotham Group', 'id': 3672}, {'name': 'Dayday Films', 'id': 8569}, {'name': 'Temple Hill Entertainment', 'id': 12292}, {'name': 'TSG Entertainment', 'id': 22213}]",2014-09-10,348319861.0,113.0,Released,Run - Remember - Survive,The Maze Runner,7.0,5540.0,/eQ8iwAvGfuNnPjBCKTIVp5PsFw.jpg
"{'id': 404609, 'name': 'John Wick Collection', 'poster_path': '/uGhPxTrmT5yASzZrR1oz1ft9UWr.jpg', 'backdrop_path': '/fSwYa5q2xRkBoOOjueLpkLf3N1m.jpg'}","[{'id': 28, 'name': 'Action'}, {'id': 53, 'name': 'Thriller'}]",245891,tt2911666,en,John Wick,Ex-lunatic John Wick comes off his meds to track down the bounders that killed his dog and made off with his self-respect,183.870374,/5vHssUeVe25bMrof1HyaPyWgaP.jpg,"[{'name': 'Summit Entertainment', 'id': 491}, {'name': 'Warner Bros.', 'id': 6194}, {'name': '87Eleven', 'id': 23008}, {'name': 'DefyNite Films', 'id': 36259}, {'name': 'MJW Films', 'id': 36433}]",2014-10-22,88761661.0,101.0,Released,Don't set him off.,John Wick,7.0,5499.0,/fSwYa5q2xRkBoOOjueLpkLf3N1m.jpg
"{'id': 138965, 'name': 'The Mummy (Hammer Series)', 'poster_path': '/90f5SF3s02ndW498kGdm2lIVpYp.jpg', 'backdrop_path': '/iLmCaLaw9Tn8JeFtUbhlaNVFcga.jpg'}","[{'id': 27, 'name': 'Horror'}]",39263,tt0068290,en,Blood from the Mummy's Tomb,"Two Egyptologists, Professor Fuchs and Corbeck, are instrumental in unleashing unmitigated horror by bringing back to England the mummified body of Tara, the Egyptian Queen of Darkness. Fuchs’s daughter becomes involved in a series of macabre and terrifying incidents, powerless against the forces of darkness, directed by Corbeck, that are taking possession of her body and soul to fulfill the ancient prophesy that Queen Tara will be resurrected to continue her reign of unspeakable evil.",6.353881,/qVu0K3t902Nl1eFevjXBh3owd6A.jpg,"[{'name': 'Hammer Film Productions', 'id': 1314}]",1971-06-16,0.0,94.0,Released,A severed hand beckons from an open grave!,Blood from the Mummy's Tomb,6.4,19.0,/iLmCaLaw9Tn8JeFtUbhlaNVFcga.jpg
"{'id': 115225, 'name': 'Children of the Corn Collection', 'poster_path': '/v6auJblMcNxUmZx23mQXMHmzyY3.jpg', 'backdrop_path': '/g4aK8Up5zSegesJdMYbxDcndn20.jpg'}","[{'id': 18, 'name': 'Drama'}, {'id': 27, 'name': 'Horror'}, {'id': 53, 'name': 'Thriller'}]",25754,tt1290135,en,Children of the Corn,"Set primarily in 1975 in the fictional town of Gatlin, Nebraska this remake of the 1984 original (based on Stephen King's 1977 short story) centers around traveling couple Burt and Vicky as they fight to survive a cult of murderous children who worship an entity known as He Who Walks Behind The Rows, which had years earlier manipulated the children into killing every adult in town.",9.895965,/uPN6jFFU3vpXE86Yjo6a3S5SNLx.jpg,"[{'name': 'Children of the Corn Productions', 'id': 4417}]",2009-09-26,0.0,92.0,Released,,Children of the Corn,4.3,45.0,/g4aK8Up5zSegesJdMYbxDcndn20.jpg
"{'id': 115225, 'name': 'Children of the Corn Collection', 'poster_path': '/v6auJblMcNxUmZx23mQXMHmzyY3.jpg', 'backdrop_path': '/g4aK8Up5zSegesJdMYbxDcndn20.jpg'}","[{'id': 27, 'name': 'Horror'}]",25753,tt0279730,en,Children of the Corn: Revelation,"When a girl named Jamie repeatedly tries to contact her grandmother to no avail, she investigates by going to her apartment in Omaha Nebraska - only to find that it's been condemned and overtaken by possessed children. As she digs deeper, she discovers a dark secret about her grandmother and awakens a dark, demonic force that wants Jamie dead and will stop at nothing.",2.58429,/sL3ZaPFwgkfn9KuIsh861zsPX0Y.jpg,"[{'name': 'Neo Art & Logic', 'id': 2811}, {'name': 'Creepersin Films', 'id': 19576}]",2001-10-09,0.0,82.0,Released,"The All-New, Terror-Filled Chapter!",Children of the Corn: Revelation,3.7,24.0,/g4aK8Up5zSegesJdMYbxDcndn20.jpg
"{'id': 174245, 'name': 'Alien Nation Collection', 'poster_path': '/gsP7dt9uUkkdl0bL4kU9o9jeehO.jpg', 'backdrop_path': '/s8TyKSfmSlvaLKTqJLpkCCIiLK8.jpg'}","[{'id': 878, 'name': 'Science Fiction'}]",24047,tt0109078,en,Alien Nation: Dark Horizon,"Followup movie to the TV series about 250,000 aliens, or ""newcomers"" as they are known, who have by now settled alongside the humans in California. Most of the newcomers were slaves, and the slave masters are now looking for them. They send Aponso to earth to locate the slaves ready for the aliens to pick them up.",3.834165,/c7pJn7VkqW3b6EXlZieIEyA0SmA.jpg,[],1994-10-25,0.0,90.0,Released,,Alien Nation: Dark Horizon,6.2,10.0,/s8TyKSfmSlvaLKTqJLpkCCIiLK8.jpg
"{'id': 174245, 'name': 'Alien Nation Collection', 'poster_path': '/gsP7dt9uUkkdl0bL4kU9o9jeehO.jpg', 'backdrop_path': '/s8TyKSfmSlvaLKTqJLpkCCIiLK8.jpg'}","[{'id': 878, 'name': 'Science Fiction'}]",81244,tt0115505,en,Alien Nation: The Enemy Within,"When detectives Sikes and Francisco are presented with the mysterious death of an Eeno, Matt is stupefied to discover that George rudely snubs the case. He, like most newcomers, reviles the outcast Eenos. As the case unfolds, George has to reassess his prejudices, and George's family help save the city from an alien threat originating in an Eeno waste disposal facility.",0.33895,/paqCCTLdT0onx6JWKADioE9XPim.jpg,"[{'name': '20th Century Fox Television', 'id': 1556}]",1996-11-12,0.0,91.0,Released,,Alien Nation: The Enemy Within,5.7,6.0,/s8TyKSfmSlvaLKTqJLpkCCIiLK8.jpg
"{'id': 174245, 'name': 'Alien Nation Collection', 'poster_path': '/gsP7dt9uUkkdl0bL4kU9o9jeehO.jpg', 'backdrop_path': '/s8TyKSfmSlvaLKTqJLpkCCIiLK8.jpg'}","[{'id': 878, 'name': 'Science Fiction'}]",50291,tt0115504,en,Alien Nation: Millennium,"It's 1999, and as the end of the millenium approaches, people are attempting to find spiritual enlightenment. But a few people want to skip all the work that entails, and a holy Tenktonese relic in the hands of a heretic is giving them a shortcut. But it's not quite as easily controlled as she says.",1.787853,/8UA2DX7rjgny5RZxZzGTOR0omrx.jpg,"[{'name': '20th Century Fox Television', 'id': 1556}, {'name': 'National Studios Inc.', 'id': 39302}]",1996-01-02,0.0,90.0,Released,,Alien Nation: Millennium,5.5,8.0,/s8TyKSfmSlvaLKTqJLpkCCIiLK8.jpg
"{'id': 3169, 'name': 'Dr. Dolittle Collection', 'poster_path': '/gCY8N724wNeAfegWCAkTjUSMr34.jpg', 'backdrop_path': '/dtz0ju3dikZaiSJ9HmVoMs9imT8.jpg'}","[{'id': 35, 'name': 'Comedy'}, {'id': 10751, 'name': 'Family'}, {'id': 14, 'name': 'Fantasy'}]",19273,tt1080926,en,Dr. Dolittle: Million Dollar Mutts,"Maya Dolittle (Kyla Pratt) thinks she doesn't have to spend 7 years in college to be a vet because she can talk to animals. While taking a walk with Lucky, she helps a cat on a tree by talking to it. She gets discovered and Tiffany Monaco (Tegan Moss), a Hollywood star, brings her to L.A. to help her little puppy, who turns out to be a boy. Soon, Maya and Tiffany began creating their own show, The Animal Talkers. Maya also meets Brandon Turner (Brandon Jay McLaren) who is her love interest. Maya soon finds out the show isn't about helping animals and goes back home to study being a vet. She also finds out Brandon is at her school too. Meanwhile, Monkey is out in L.A. searching for his big break but quits because he wants to help Maya.",1.879745,/iZz5ywVTaPlvp3Fkk4iC4Xj1KcR.jpg,"[{'name': 'Twentieth Century Fox Home Entertainment', 'id': 10999}]",2009-04-08,0.0,90.0,Released,,Dr. Dolittle: Million Dollar Mutts,5.5,12.0,/dtz0ju3dikZaiSJ9HmVoMs9imT8.jpg
"{'id': 169452, 'name': 'DragonHeart Collection', 'poster_path': '/bZsqwJnO65wlZ3ez7dopUQMYALY.jpg', 'backdrop_path': '/hRucBWgzCc7iA9avUE2k5gc7dkj.jpg'}","[{'id': 28, 'name': 'Action'}, {'id': 12, 'name': 'Adventure'}, {'id': 35, 'name': 'Comedy'}, {'id': 14, 'name': 'Fantasy'}]",10473,tt0214641,en,DragonHeart: A New Beginning,"When Geoff, an orphaned stable boy (Chris Masterson), discovers Drake (voice of Robby Benson), the world's last living dragon, he realizes that his dream of becoming a knight in shining armor can now come true. Together, they soon face challenges that turn them into heroes. But caught up in the excitement of their new lives, Geoff and Drake fail to see the hidden dangers that surround them.",8.319796,/8mbg22L9MdSyELeNwEJkMDVsEVO.jpg,[],2000-08-08,0.0,84.0,Released,,DragonHeart: A New Beginning,5.5,70.0,/hRucBWgzCc7iA9avUE2k5gc7dkj.jpg
"{'id': 101385, 'name': 'Trailer Park Boys Collection', 'poster_path': '/rnpQXPaiiS90KidhNI34maU9aiW.jpg', 'backdrop_path': '/wy72negkJZcoOKkYkaWR7qgSXSF.jpg'}",[],303742,tt3596200,en,Trailer Park Boys: Live at the North Pole,"Bubbles and the other boys get a letter from a TPB fan club president in Minneapolis, Minnesota to do a live show at the State Theatre for Christmas. Ricky goes along with it to make nice with Santa Jesus God after a rough-up the previous year, while Julian brings along Randy to sell 60/40 raffle tickets and make some money. Mr. Lahey sneaks along to spoil the boys' fun. A Netflix original production.",1.43617,/vEOzFZZ8fCAgxAAq4iSqcjQrcPN.jpg,[],2014-11-15,0.0,88.0,Released,Santa Fights Dirty,Trailer Park Boys: Live at the North Pole,7.6,8.0,/wy72negkJZcoOKkYkaWR7qgSXSF.jpg
"{'id': 85943, 'name': 'Night at the Museum Collection', 'poster_path': '/q2nwE0Qi8U6tsU5HDmiWS2D3dSJ.jpg', 'backdrop_path': '/fOmqiIXfJmeANciOTCN6WkKbwK.jpg'}","[{'id': 12, 'name': 'Adventure'}, {'id': 35, 'name': 'Comedy'}, {'id': 14, 'name': 'Fantasy'}, {'id': 10751, 'name': 'Family'}]",181533,tt2692250,en,Night at the Museum: Secret of the Tomb,"When the magic powers of The Tablet of Ahkmenrah begin to die out, Larry Daley (Ben Stiller) spans the globe, uniting favorite and new characters while embarking on an epic quest to save the magic before it is gone forever.",19.539436,/tWwASv4CU1Au1IukacdSUewDCV3.jpg,"[{'name': 'Twentieth Century Fox Film Corporation', 'id': 306}, {'name': '1492 Pictures', 'id': 436}, {'name': '21 Laps Entertainment', 'id': 2575}, {'name': 'Moving Picture Company (MPC)', 'id': 20478}, {'name': 'TSG Entertainment', 'id': 22213}]",2014-12-17,349424282.0,97.0,Released,One Final Night to Save the Day.,Night at the Museum: Secret of the Tomb,6.1,1893.0,/fOmqiIXfJmeANciOTCN6WkKbwK.jpg
"{'id': 99727, 'name': 'Stuart Little Collection', 'poster_path': '/tBWjHQBmEa91Pa3R96zGdosULom.jpg', 'backdrop_path': '/diOx2L0SIlgrriuYebChp9UNX65.jpg'}","[{'id': 14, 'name': 'Fantasy'}, {'id': 16, 'name': 'Animation'}, {'id': 35, 'name': 'Comedy'}, {'id': 878, 'name': 'Science Fiction'}, {'id': 10751, 'name': 'Family'}]",30178,tt0472602,en,Stuart Little 3: Call of the Wild,"With school out for the summer, the Littles are vacationing in a cabin by the lake, and Stuart is so excited he could burst! But when Snowbell the cat is captured by a mean-spirited creature known simply as the Beast, it's up to Stuart and a skunk named Reeko to rescue him and a few other friends.",4.014225,/8yysUCHpRQX9viGCWM6Fj8bHIP5.jpg,"[{'name': 'Mainframe Entertainment', 'id': 5024}]",2005-07-14,0.0,72.0,Released,,Stuart Little 3: Call of the Wild,4.6,65.0,/diOx2L0SIlgrriuYebChp9UNX65.jpg
"{'id': 97445, 'name': 'Air Bud Collection', 'poster_path': '/6uJ2GXA5kBskJx6emTuHyp2S3ww.jpg', 'backdrop_path': '/3iROV2GdrAFz6lbrGneQLt8lc7K.jpg'}","[{'id': 35, 'name': 'Comedy'}, {'id': 18, 'name': 'Drama'}, {'id': 10751, 'name': 'Family'}]",21518,tt0288415,en,Air Bud: Seventh Inning Fetch,Josh is off to his first year of college and buddy has stayed behind with joshs little sister andrea and the rest of the family. Adrea attempting to fit in with her jr. High classmates decides to join the baseball team and along the way discovers that buddy is a talented baseball player.,1.757138,/lQ2TWSJq4s9U8h3DPnUsgEpCR3y.jpg,"[{'name': 'Fetch Boy Films Ltd.', 'id': 15707}, {'name': 'International Keystone Entertainment', 'id': 15708}, {'name': 'Keystone Pictures', 'id': 15709}]",2002-06-18,0.0,93.0,Released,He's A Natural Baseball Player With Major League Talent!,Air Bud: Seventh Inning Fetch,4.6,34.0,/3iROV2GdrAFz6lbrGneQLt8lc7K.jpg
