belongs_to_collection,genres,id,imdb_id,original_language,original_title,overview,popularity,poster_path,production_companies,release_date,revenue,runtime,status,tagline,title,vote_average,vote_count,backdrop_path
"{'id': 87186, 'name': 'The Boondock Saints Collection', 'poster_path': '/u4hp2I1DgWw2ZnkX2VTZDixGP87.jpg', 'backdrop_path': '/kdxXEiS3sDB7pvQapiqiTRbwkKr.jpg'}","[{'id': 28, 'name': 'Action'}, {'id': 53, 'name': 'Thriller'}, {'id': 80, 'name': 'Crime'}]",8374,tt0144117,en,The Boondock Saints,"With a God-inspired moral obligation to act against evil, twin brothers Conner and Murphy set out to rid Boston of criminals. However, rather than working within the system, these Irish Americans decide to take swift retribution into their own hands.",12.457908,/fg6fhyKg3vbdGtnf9Hq27Q5gS3r.jpg,"[{'name': 'Franchise Pictures', 'id': 1403}, {'name': 'Brood Syndicate', 'id': 11342}, {'name': 'B.D.S. Productions Inc.', 'id': 20088}]",1999-01-22,30471.0,108.0,Released,Thy Kingdom Come. Thy Will Be Done.,The Boondock Saints,7.2,848.0,/kdxXEiS3sDB7pvQapiqiTRbwkKr.jpg
"{'id': 14377, 'name': 'Death Wish Collection', 'poster_path': '/3mC5lppASzZHx5IlmFSL6cPQpCP.jpg', 'backdrop_path': '/m3K7AXN8Wi6VIRtVlpF1E6nzEn1.jpg'}","[{'id': 53, 'name': 'Thriller'}, {'id': 28, 'name': 'Action'}, {'id': 12, 'name': 'Adventure'}, {'id': 80, 'name': 'Crime'}]",26263,tt0092857,en,Death Wish 4: The Crackdown,"After the death of his girlfriend's daughter from a drug overdose, Paul Kersey (Charles Bronson) takes on the local drug cartel.",4.566325,/8yVdLJa5ywqwNAKU1nmUtDJlx8b.jpg,"[{'name': 'Cannon Group', 'id': 1444}]",1987-06-11,0.0,99.0,Released,This time it's war!,Death Wish 4: The Crackdown,5.6,51.0,/m3K7AXN8Wi6VIRtVlpF1E6nzEn1.jpg
"{'id': 14377, 'name': 'Death Wish Collection', 'poster_path': '/3mC5lppASzZHx5IlmFSL6cPQpCP.jpg', 'backdrop_path': '/m3K7AXN8Wi6VIRtVlpF1E6nzEn1.jpg'}","[{'id': 28, 'name': 'Action'}, {'id': 80, 'name': 'Crime'}, {'id': 18, 'name': 'Drama'}, {'id': 53, 'name': 'Thriller'}]",34746,tt0109578,en,Death Wish 5: The Face of Death,"Paul Kersey is back at working vigilante justice when when his fiancée, Olivia, has her business threatened by mobsters",3.595599,/mWLBf0aSW9CPZcBvTEVglGlx3QT.jpg,"[{'name': '21st Century Film Corporation', 'id': 13282}, {'name': 'Death Wish 5 Productions', 'id': 21335}]",1994-01-14,1702394.0,95.0,Released,No judge. No jury. No appeals. No deals.,Death Wish 5: The Face of Death,5.0,46.0,/m3K7AXN8Wi6VIRtVlpF1E6nzEn1.jpg
"{'id': 119050, 'name': 'Grumpy Old Men Collection', 'poster_path': '/nLvUdqgPgm3F85NMCii9gVFUcet.jpg', 'backdrop_path': '/hypTnLot2z8wpFS7qwsQHW1uV8u.jpg'}","[{'id': 35, 'name': 'Comedy'}, {'id': 10751, 'name': 'Family'}, {'id': 10749, 'name': 'Romance'}]",11520,tt0107050,en,Grumpy Old Men,"For decades, next-door neighbors and former friends John and Max have feuded, trading insults and wicked pranks. When an attractive widow moves in nearby, their bad blood erupts into a high-stakes rivalry full of naughty jokes and adolescent hijinks. Will this love triangle destroy the two old grumps? Or will the geriatric odd couple overcome their differences and rediscover their friendship?",7.529482,/w4q0vMlJCeNQnUMsVbjB3DiH1mw.jpg,"[{'name': 'Warner Bros.', 'id': 6194}, {'name': 'Lancaster Gate', 'id': 19464}, {'name': 'John Davis', 'id': 19465}]",1993-12-25,0.0,103.0,Released,The best of enemies until something came between them.,Grumpy Old Men,6.5,176.0,/hypTnLot2z8wpFS7qwsQHW1uV8u.jpg
"{'id': 399, 'name': 'Predator Collection', 'poster_path': '/6Z7lASptoiRVxiCFvZaFgH9qp7u.jpg', 'backdrop_path': '/fXVzk9OxQwROCuiWvd0Cv76qmZi.jpg'}","[{'id': 878, 'name': 'Science Fiction'}, {'id': 28, 'name': 'Action'}, {'id': 12, 'name': 'Adventure'}, {'id': 53, 'name': 'Thriller'}]",106,tt0093773,en,Predator,"Dutch and his group of commandos are hired by the CIA to rescue downed airmen from guerillas in a Central American jungle. The mission goes well but as they return they find that something is hunting them. Nearly invisible, it blends in with the forest, taking trophies from the bodies of its victims as it goes along. Occasionally seeing through its eyes, the audience sees it is an intelligent alien hunter, hunting them for sport, killing them off one at a time.",18.495694,/bj7A0teF2TWxxNGZjWTXiGrvCu2.jpg,"[{'name': 'Twentieth Century Fox Film Corporation', 'id': 306}, {'name': 'Lawrence Gordon Productions', 'id': 840}, {'name': 'Davis Entertainment', 'id': 1302}, {'name': 'Silver Pictures', 'id': 1885}, {'name': 'Amercent Films', 'id': 5263}, {'name': 'American Entertainment Partners L.P.', 'id': 5264}]",1987-06-11,98235548.0,107.0,Released,"If it bleeds, we can kill it...",Predator,7.3,2129.0,/fXVzk9OxQwROCuiWvd0Cv76qmZi.jpg
"{'id': 351684, 'name': 'The Flintstones (Live-Action) Collection', 'poster_path': '/v70Luw2mGhib4s0Osw7Ux8rQgBt.jpg', 'backdrop_path': '/qD0rip0E8EcRcjCPcdu5wUknLZJ.jpg'}","[{'id': 878, 'name': 'Science Fiction'}, {'id': 35, 'name': 'Comedy'}, {'id': 10751, 'name': 'Family'}, {'id': 10749, 'name': 'Romance'}]",889,tt0158622,en,The Flintstones in Viva Rock Vegas,"The Flintstones are at it again. The Flintstones and the Rubbles head for Rock Vegas with Fred hoping to court the lovely Wilma. Nothing will stand in the way of love, except for the conniving Chip Rockefeller who is the playboy born in Baysville but who has made it in the cutthroat town of Rock Vegas. Will Fred win Wilma's love?",6.053595,/nEkMYwctrUH8ueaAcJFZnAEltMX.jpg,"[{'name': 'Universal Pictures', 'id': 33}, {'name': 'Amblin Entertainment', 'id': 56}]",2000-04-28,59468275.0,90.0,Released,Get ready to rock!,The Flintstones in Viva Rock Vegas,4.4,140.0,/qD0rip0E8EcRcjCPcdu5wUknLZJ.jpg
"{'id': 207447, 'name': 'Firestarter Collection', 'poster_path': '/6kLGcwTZMXPBoj1a0CkhWergeXM.jpg', 'backdrop_path': '/sunRcFLsmQH9TVVUzogdTwtCleB.jpg'}","[{'id': 14, 'name': 'Fantasy'}, {'id': 18, 'name': 'Drama'}, {'id': 27, 'name': 'Horror'}, {'id': 28, 'name': 'Action'}, {'id': 53, 'name': 'Thriller'}]",11495,tt0087262,en,Firestarter,"As youths, Andy McGee (David Keith) and his future wife, Vicky (Heather Locklear), participated in secret experiments, allowing themselves to be subjected to mysterious medical tests. Years later, the couple's daughter, Charlie (Drew Barrymore), begins to exhibit the ability of setting fires solely with her mind. This volatile talent makes the youngster extremely dangerous and soon she becomes a target for the enigmatic agency known as ""The Shop.""",7.048087,/nIo0DYQ7mcRLYUuihN4gao9Xupj.jpg,"[{'name': 'Universal Pictures', 'id': 33}, {'name': 'Dino De Laurentiis Company', 'id': 10308}]",1984-05-11,17080167.0,114.0,Released,Will she have the power... to survive?,Firestarter,5.9,174.0,/sunRcFLsmQH9TVVUzogdTwtCleB.jpg
"{'id': 138974, 'name': 'The Sorority House Massacre Collection', 'poster_path': '/gTSLlSlYg02JUG7s58qdQ5BeIxl.jpg', 'backdrop_path': '/7qp2haLhI4WTxxbMnzvXiQaCxIS.jpg'}","[{'id': 35, 'name': 'Comedy'}, {'id': 27, 'name': 'Horror'}, {'id': 53, 'name': 'Thriller'}]",40446,tt0100663,en,Sorority House Massacre II,"Five college women buy the old Hokstedter place for their new sorority house. They got it cheap because of the bloody incidents from five years before. They decide to stay in it for the night so they can meet the movers in the morning, but begin to get the creeps when the weird neighbor Orville Ketchum starts poking around. Shortly after the women take showers and consult a Ouija board they begin experiencing an attrition problem.",0.763373,/h6cCCjnU2MsvMYucg3VQwvyUnqE.jpg,"[{'name': 'New Concorde', 'id': 4893}]",1990-10-05,0.0,80.0,Released,It's Cleavage vs. Cleavers and the result is Delta Delta Deadly!,Sorority House Massacre II,5.0,12.0,/7qp2haLhI4WTxxbMnzvXiQaCxIS.jpg
"{'id': 39244, 'name': 'Digimon Collection', 'poster_path': '/eHRPNtZMjJKHosAMD87dn7HGM9r.jpg', 'backdrop_path': '/vfwyCkgzgoQ1l0trt7wIr77VL4Q.jpg'}","[{'id': 14, 'name': 'Fantasy'}, {'id': 16, 'name': 'Animation'}, {'id': 878, 'name': 'Science Fiction'}, {'id': 10751, 'name': 'Family'}]",20455,tt0259974,en,Digimon: The Movie,"The first story focused on Tai and Kari Kamiya four years before their adventure in the Digital World. It shows their first encounter with Digimon and what happened to them (as well as the other children). Tai and Kari wake one morning to find a Digi-Egg that came out of their computer the night before and the egg soon hatches, revealing a Botamon. The Digimon then evolves into Koromon and then Agumon (not the same one that became friends with Tai in the series, and yet, somehow, both Koromon and Kari remember each other), who then goes out and unintentionally destroys a good part of the neighborhood with Kari riding on his back. A second Digi-Egg appears in the sky to reveal an evil digimon, Parrotmon. Agumon then Digivolves to Greymon but isn't strong enough to beat Parrotmon and is knocked out. Tai grabs Kari's whistle and wakes up Greymon, who defeats Parrotmon and disappears with him.",5.300501,/1VVJoSgGLxRE0DGDIE8eztOjUXv.jpg,"[{'name': 'Saban Entertainment', 'id': 2106}, {'name': 'Toei', 'id': 5822}]",2000-03-17,0.0,82.0,Released,,Digimon: The Movie,6.2,76.0,/vfwyCkgzgoQ1l0trt7wIr77VL4Q.jpg
"{'id': 124916, 'name': '101 Dalmatians (Live-Action) Collection', 'poster_path': '/oSeIai1ioj4dbq7WgbPzpsSCzkS.jpg', 'backdrop_path': '/eTaNHqpi7VldgcrDetfTzk4FeDi.jpg'}","[{'id': 35, 'name': 'Comedy'}, {'id': 10751, 'name': 'Family'}]",10481,tt0211181,en,102 Dalmatians,"Get ready for a howling good time as an all new assortment of irresistible animal heroes are unleashed in this great family tail! In an unlikely alliance, the outrageous Waddlesworth... a parrot who thinks he's a Rottweiler... teams up with Oddball... an un-marked Dalmation puppy eager to earn her spots! Together they embark on a laugh-packed quest to outwit the ever-scheming Cruella De Vil",7.668752,/dSxnIika9yWwTvEbpsmoGdeh65E.jpg,"[{'name': 'Walt Disney Pictures', 'id': 2}, {'name': 'Cruella Productions', 'id': 10472}]",2000-10-07,183611771.0,100.0,Released,Meet Two Unlikely Heroes With A Bone To Pick.,102 Dalmatians,5.1,327.0,/eTaNHqpi7VldgcrDetfTzk4FeDi.jpg
"{'id': 93220, 'name': 'Miss Congeniality Collection', 'poster_path': '/wgQWsSsvB1iu1Pwc4nUP9E5bRzs.jpg', 'backdrop_path': '/7TIT28YbhAOeQGD2q2hJ9j83jI1.jpg'}","[{'id': 35, 'name': 'Comedy'}, {'id': 80, 'name': 'Crime'}, {'id': 28, 'name': 'Action'}]",1493,tt0212346,en,Miss Congeniality,"When the local FBI office receives a letter from a terrorist known only as 'The Citizen', it's quickly determined that he's planning his next act at the Miss America beauty pageant. Because tough-as-nails Gracie Hart is the only female Agent at the office, she's chosen to go undercover as the contestant from New Jersey.",9.510762,/mILq93mndRkMRz1MgaKqD3WpR1d.jpg,"[{'name': 'Village Roadshow Pictures', 'id': 79}, {'name': 'Castle Rock Entertainment', 'id': 97}, {'name': 'NPV Entertainment', 'id': 172}, {'name': 'Fortis Films', 'id': 4258}]",2000-12-14,212000000.0,111.0,Released,Never Mess With An Agent In A Dress.,Miss Congeniality,6.1,987.0,/7TIT28YbhAOeQGD2q2hJ9j83jI1.jpg
"{'id': 9743, 'name': 'The Hannibal Lecter Anthology', 'poster_path': '/aRbyr3KsdmIczGh6VrlvlgQdwMQ.jpg', 'backdrop_path': '/npCbvak9UhjPsZB9Oa2k2jsqI7E.jpg'}","[{'id': 80, 'name': 'Crime'}, {'id': 18, 'name': 'Drama'}, {'id': 53, 'name': 'Thriller'}, {'id': 27, 'name': 'Horror'}]",9740,tt0212985,en,Hannibal,"After having successfully eluded the authorities for years, Hannibal peacefully lives in Italy in disguise as an art scholar. Trouble strikes again when he's discovered leaving a deserving few dead in the process. He returns to America to make contact with now disgraced Agent Clarice Starling, who is suffering the wrath of a malicious FBI rival as well as the media.",2.48875,/v5wAZwRqpGWmyAaaJ8BBHYuNXnj.jpg,"[{'name': 'Universal Pictures', 'id': 33}, {'name': 'Scott Free Productions', 'id': 1645}, {'name': 'Metro-Goldwyn-Mayer (MGM)', 'id': 8411}, {'name': 'Dino De Laurentiis Company', 'id': 10308}]",2001-02-08,351692268.0,131.0,Released,"His genius undeniable. His evil, unspeakable.",Hannibal,6.4,1296.0,/npCbvak9UhjPsZB9Oa2k2jsqI7E.jpg
"{'id': 10893, 'name': 'Critters Collection', 'poster_path': '/rWZytVHeFsADHeuoPCIf4c7Qepb.jpg', 'backdrop_path': '/9K0ycQWRv4vSL1oM8y7dOXwFpy6.jpg'}","[{'id': 28, 'name': 'Action'}, {'id': 35, 'name': 'Comedy'}, {'id': 27, 'name': 'Horror'}, {'id': 878, 'name': 'Science Fiction'}, {'id': 53, 'name': 'Thriller'}]",3980,tt0090887,en,Critters,A massive ball of furry creatures from another world eat their way through a small mid-western town followed by intergalactic bounty hunters opposed only by militant townspeople.,10.113807,/7tFJqfcmu7sAxwcRwQ0j9qnGrok.jpg,"[{'name': 'New Line Cinema', 'id': 12}, {'name': 'Smart Egg Pictures', 'id': 1531}, {'name': 'Sho Films', 'id': 1532}]",1986-04-11,13167232.0,82.0,Released,"They eat so fast, you don't have time to scream.",Critters,5.9,221.0,/9K0ycQWRv4vSL1oM8y7dOXwFpy6.jpg
"{'id': 10893, 'name': 'Critters Collection', 'poster_path': '/rWZytVHeFsADHeuoPCIf4c7Qepb.jpg', 'backdrop_path': '/9K0ycQWRv4vSL1oM8y7dOXwFpy6.jpg'}","[{'id': 35, 'name': 'Comedy'}, {'id': 27, 'name': 'Horror'}, {'id': 878, 'name': 'Science Fiction'}, {'id': 53, 'name': 'Thriller'}]",10127,tt0094919,en,Critters 2,"A batch of unhatched critter eggs are mistaken for Easter eggs by the country-folk inhabitants of Grover's Bend and, before long, the ferocious furballs are on the rampage again.",9.97523,/8aEf1xiAemsZIMpAL6pHQeJvOw2.jpg,"[{'name': 'New Line Cinema', 'id': 12}, {'name': 'Sho Films', 'id': 1532}]",1988-04-29,3813293.0,86.0,Released,Get Ready for Seconds... They're Back,Critters 2,5.0,91.0,/9K0ycQWRv4vSL1oM8y7dOXwFpy6.jpg
"{'id': 19163, 'name': 'The Land Before Time Collection', 'poster_path': '/n1bjdBVThBezxR6nEf2dy43sTtV.jpg', 'backdrop_path': '/alkvR9vTtuZEmd5ygsayOfxYOMa.jpg'}","[{'id': 16, 'name': 'Animation'}, {'id': 12, 'name': 'Adventure'}, {'id': 10751, 'name': 'Family'}]",12144,tt0095489,en,The Land Before Time,"An orphaned brontosaurus named Littlefoot sets off in search of the legendary Great Valley. A land of lush vegetation where the dinosaurs can thrive and live in peace. Along the way he meets four other young dinosaurs, each one a different species, and they encounter several obstacles as they learn to work together in order to survive.",13.631352,/hkKSmDRnbKUBAyZszz9b4kcQhvt.jpg,"[{'name': 'Lucasfilm', 'id': 1}, {'name': 'Universal Pictures', 'id': 33}, {'name': 'Amblin Entertainment', 'id': 56}, {'name': 'Sullivan Bluth Studios', 'id': 6422}, {'name': 'U-Drive Productions', 'id': 20448}, {'name': 'Universal City Studios', 'id': 69627}]",1988-11-18,84460846.0,69.0,Released,A new adventure is born.,The Land Before Time,7.0,660.0,/alkvR9vTtuZEmd5ygsayOfxYOMa.jpg
"{'id': 98853, 'name': 'Cyborg Collection', 'poster_path': '/fxf2Md5RGMMxgM9yNyr0h1Wvaxu.jpg', 'backdrop_path': '/5EGXww0h3TJ3xaHJ0sNEmbRPn35.jpg'}","[{'id': 28, 'name': 'Action'}, {'id': 878, 'name': 'Science Fiction'}]",10134,tt0097138,en,Cyborg,A martial artist hunts a killer in a plague-infested urban dump of the future.,8.473602,/nOspcG8HP6KPdMvzezavRbzYCEw.jpg,"[{'name': 'Cannon Group', 'id': 1444}, {'name': 'Golan-Globus', 'id': 1445}]",1989-04-07,10166459.0,86.0,Released,He's the First Hero of the 21st Century... And He's Our Only Hope.,Cyborg,4.9,154.0,/5EGXww0h3TJ3xaHJ0sNEmbRPn35.jpg
"{'id': 88735, 'name': 'K-9 Collection', 'poster_path': '/moEkdT6SE1HxR9QHwor6DJX8NYe.jpg', 'backdrop_path': '/mdG3H2w9Ktc2Ua6tJie3eUE8Zte.jpg'}","[{'id': 28, 'name': 'Action'}, {'id': 35, 'name': 'Comedy'}, {'id': 80, 'name': 'Crime'}]",10345,tt0097637,en,K-9,"The extravagant cop Michael Dooley needs some help to fight a drug dealer who has tried to kill him. A ""friend"" gives him a dog named Jerry Lee (Officer Lewis), who has been trained to smell drugs. With his help, Dooley sets out to put his enemy behind the bars, but Jerry Lee has a personality of his own and works only when he wants to. On the other hand, the dog is quite good at destroying Dooley's car, house and sex-life...",5.772293,/4SmGgyoIRzOqLI9M5lof2e00B16.jpg,"[{'name': 'Universal Pictures', 'id': 33}, {'name': 'Gordon Company', 'id': 1073}]",1989-04-28,78247647.0,101.0,Released,Meet the two toughest cops in town.  One's just a little smarter than the other!,K-9,5.5,209.0,/mdG3H2w9Ktc2Ua6tJie3eUE8Zte.jpg
"{'id': 119, 'name': 'The Lord of the Rings Collection', 'poster_path': '/p4UokEk2XnjjRTdXGe6DLYXlbI1.jpg', 'backdrop_path': '/bccR2CGTWVVSZAG0yqmy3DIvhTX.jpg'}","[{'id': 12, 'name': 'Adventure'}, {'id': 14, 'name': 'Fantasy'}, {'id': 28, 'name': 'Action'}]",120,tt0120737,en,The Lord of the Rings: The Fellowship of the Ring,"Young hobbit Frodo Baggins, after inheriting a mysterious ring from his uncle Bilbo, must leave his home in order to keep it from falling into the hands of its evil creator. Along the way, a fellowship is formed to protect the ringbearer and make sure that the ring arrives at its final destination: Mt. Doom, the only place where it can be destroyed.",32.070725,/bxVxZb5O9OxCO0oRUNdCnpy9NST.jpg,"[{'name': 'WingNut Films', 'id': 11}, {'name': 'New Line Cinema', 'id': 12}, {'name': 'The Saul Zaentz Company', 'id': 5237}]",2001-12-18,871368364.0,178.0,Released,One ring to rule them all,The Lord of the Rings: The Fellowship of the Ring,8.0,8892.0,/bccR2CGTWVVSZAG0yqmy3DIvhTX.jpg
"{'id': 8354, 'name': 'Ice Age Collection', 'poster_path': '/stQoHvo0q6ZcEkji2Z1wlAxKnDq.jpg', 'backdrop_path': '/2Mb92Ssoe1eUecvrCe2pEvgAlmv.jpg'}","[{'id': 16, 'name': 'Animation'}, {'id': 35, 'name': 'Comedy'}, {'id': 10751, 'name': 'Family'}, {'id': 12, 'name': 'Adventure'}]",425,tt0268380,en,Ice Age,"With the impending ice age almost upon them, a mismatched trio of prehistoric critters – Manny the woolly mammoth, Diego the saber-toothed tiger and Sid the giant sloth – find an orphaned infant and decide to return it to its human parents. Along the way, the unlikely allies become friends but, when enemies attack, their quest takes on far nobler aims.",17.328902,/zpaQwR0YViPd83bx1e559QyZ35i.jpg,"[{'name': 'Twentieth Century Fox Film Corporation', 'id': 306}, {'name': 'Blue Sky Studios', 'id': 9383}, {'name': 'Twentieth Century Fox Animation', 'id': 11749}]",2002-03-10,383257136.0,81.0,Released,They came. They thawed. They conquered.,Ice Age,7.1,3954.0,/2Mb92Ssoe1eUecvrCe2pEvgAlmv.jpg
"{'id': 135441, 'name': 'Road to Collection', 'poster_path': '/t293kNZnkaeqnYCHPsDXh8ZLBeQ.jpg', 'backdrop_path': '/mtC7UKAlECH3NlABg8mzmDqZi0F.jpg'}","[{'id': 35, 'name': 'Comedy'}]",13861,tt0032993,en,Road to Singapore,Bing Crosby an Bob Hope star in the first of the 'Road to' movies as two playboys trying to forget previous romances in Singapore - until they meet Dorothy Lamour...,1.226779,/vCIxo9CDTnrNfYOtWDURGmPPFGZ.jpg,"[{'name': 'Paramount Pictures', 'id': 4}]",1940-03-22,0.0,85.0,Released,Ready For Fun . . Fight . . or a South Seas Romance . . . ! They find them all on the . . .,Road to Singapore,6.7,12.0,/mtC7UKAlECH3NlABg8mzmDqZi0F.jpg
"{'id': 135441, 'name': 'Road to Collection', 'poster_path': '/t293kNZnkaeqnYCHPsDXh8ZLBeQ.jpg', 'backdrop_path': '/mtC7UKAlECH3NlABg8mzmDqZi0F.jpg'}","[{'id': 35, 'name': 'Comedy'}]",29021,tt0038032,en,Road to Utopia,"Duke &amp; Chester on a ship to Skagway, Alaska, find a map to a secret gold mine, which had been stolen by thugs, McGurk &amp; Sperry. Meanwhile, Sal Van Hoyden is in Alaska to try and recover her fathers map. She falls in with Ace Larson, who wants to steal the gold mine for himself. Duke &amp; Chester, McGurk &amp; Sperry, Ace, his henchmen &amp; Sal, chase each other all over the countryside, all after the map.",1.456451,/nASL3unRBUDjAcJmE8HPjbL665M.jpg,"[{'name': 'Paramount Pictures', 'id': 4}]",1946-02-27,0.0,90.0,Released,,Road to Utopia,6.5,11.0,/mtC7UKAlECH3NlABg8mzmDqZi0F.jpg
"{'id': 135441, 'name': 'Road to Collection', 'poster_path': '/t293kNZnkaeqnYCHPsDXh8ZLBeQ.jpg', 'backdrop_path': '/mtC7UKAlECH3NlABg8mzmDqZi0F.jpg'}","[{'id': 35, 'name': 'Comedy'}]",31812,tt0034116,en,Road to Zanzibar,"Stranded in Africa, Chuck and his pal Fearless have comic versions of jungle adventures, featuring two attractive con-women.",1.208267,/wBfBCSO32lCfo3n121MnWBpNdmr.jpg,[],1941-04-11,0.0,91.0,Released,"IT'S THAT GLEESOME THREESOME AGAIN! Giving you your worth in mirth! Toping all the fun in ""Road to Singapore!""",Road to Zanzibar,5.8,9.0,/mtC7UKAlECH3NlABg8mzmDqZi0F.jpg
"{'id': 178654, 'name': 'White Fang Collection', 'poster_path': '/6GyuRqvPp3IPlaAY5xCIFKQxfQw.jpg', 'backdrop_path': '/iKJOz9eUg3Exnqq77gxHQ1zNBmc.jpg'}","[{'id': 28, 'name': 'Action'}, {'id': 12, 'name': 'Adventure'}, {'id': 18, 'name': 'Drama'}, {'id': 10751, 'name': 'Family'}]",12227,tt0103247,en,White Fang,Jack London's classic adventure story about the friendship developed between a Yukon gold hunter and the mixed dog-wolf he rescues from the hands of a man who mistreats him.,12.318052,/27wg0rVZW8hX7nWeHCwTf9DygGc.jpg,"[{'name': 'Walt Disney Pictures', 'id': 2}, {'name': 'Silver Screen Partners IV', 'id': 10282}, {'name': 'Hybrid Productions Inc.', 'id': 12608}]",1991-01-18,34793160.0,107.0,Released,"Where civilization ends, their journey begins.",White Fang,6.5,139.0,/iKJOz9eUg3Exnqq77gxHQ1zNBmc.jpg
"{'id': 10, 'name': 'Star Wars Collection', 'poster_path': '/ghd5zOQnDaDW1mxO7R5fXXpZMu.jpg', 'backdrop_path': '/d8duYyyC9J5T825Hg7grmaabfxQ.jpg'}","[{'id': 12, 'name': 'Adventure'}, {'id': 28, 'name': 'Action'}, {'id': 878, 'name': 'Science Fiction'}]",1894,tt0121765,en,Star Wars: Episode II - Attack of the Clones,"Ten years after the invasion of Naboo, the galaxy is on the brink of civil war. Under the leadership of a renegade Jedi named Count Dooku, thousands of solar systems threaten to break away from the Galactic Republic. When an assassination attempt is made on Senator Padmé Amidala, the former Queen of Naboo, twenty-year-old Jedi apprentice Anakin Skywalker is assigned to protect her. In the course of his mission, Anakin discovers his love for Padmé as well as his own darker side. Soon, Anakin, Padmé, and Obi-Wan Kenobi are drawn into the heart of the Separatist movement and the beginning of the Clone Wars.",14.072511,/2vcNFtrZXNwIcBgH5e2xXCmVR8t.jpg,"[{'name': 'Lucasfilm', 'id': 1}]",2002-05-15,649398328.0,142.0,Released,A Jedi Shall Not Know Anger. Nor Hatred. Nor Love.,Star Wars: Episode II - Attack of the Clones,6.4,4074.0,/d8duYyyC9J5T825Hg7grmaabfxQ.jpg
"{'id': 31562, 'name': 'The Bourne Collection', 'poster_path': '/lTfOZ25PhQkmGb5NHmaFnwB7b13.jpg', 'backdrop_path': '/vA5xMglyZv7yzDTj1qUTU4OvelV.jpg'}","[{'id': 28, 'name': 'Action'}, {'id': 18, 'name': 'Drama'}, {'id': 9648, 'name': 'Mystery'}, {'id': 53, 'name': 'Thriller'}]",2501,tt0258463,en,The Bourne Identity,"Wounded to the brink of death and suffering from amnesia, Jason Bourne is rescued at sea by a fisherman. With nothing to go on but a Swiss bank account number, he starts to reconstruct his life, but finds that many people he encounters want him dead. However, Bourne realizes that he has the combat and mental skills of a world-class spy – but who does he work for?",21.040126,/bXQIL36VQdzJ69lcjQR1WQzJqQR.jpg,"[{'name': 'Universal Pictures', 'id': 33}, {'name': 'Kennedy/Marshall Company, The', 'id': 7383}, {'name': 'Hypnotic', 'id': 7384}, {'name': 'Kalima Productions GmbH & Co. KG', 'id': 7385}, {'name': 'Stillking Films', 'id': 11345}]",2002-06-14,214034224.0,119.0,Released,He was the perfect weapon until he became the target.,The Bourne Identity,7.3,3640.0,/vA5xMglyZv7yzDTj1qUTU4OvelV.jpg
"{'id': 52988, 'name': 'Hot Shots! Collection', 'poster_path': '/5uzldxeEVqvdaZhE4uCT9TTz9p1.jpg', 'backdrop_path': '/iGrRouADMV9MbidImsgRORaV3q.jpg'}","[{'id': 28, 'name': 'Action'}, {'id': 35, 'name': 'Comedy'}, {'id': 10752, 'name': 'War'}]",9595,tt0102059,en,Hot Shots!,"Charlie Sheen, Lloyd Bridges, Cary Elwes, Valeria Golino and Jon Cryer co-star in director Jim Abrahams' (Airplane, Naked Gun) truly hilarious spoof of Top Gun. Recruited to join a top-secret mission for the Air Force, a renegade pilot (Sheen) finds himself coping with an incompetent admiral (Bridges) and a carefully selected squadron of flyers who are either inept or half-blind.",11.026793,/2e9g8SEXBmFysLKJZOb64ecWVTq.jpg,"[{'name': 'Twentieth Century Fox Film Corporation', 'id': 306}]",1991-07-31,181096164.0,84.0,Released,The mother of all movies.,Hot Shots!,6.4,588.0,/iGrRouADMV9MbidImsgRORaV3q.jpg
"{'id': 1241, 'name': 'Harry Potter Collection', 'poster_path': '/8Xmkc1HvCOpMlbFvVabrtr6HAsp.jpg', 'backdrop_path': '/wfnMt6LGqYHcNyOfsuusw5lX3bL.jpg'}","[{'id': 12, 'name': 'Adventure'}, {'id': 14, 'name': 'Fantasy'}, {'id': 10751, 'name': 'Family'}]",672,tt0295297,en,Harry Potter and the Chamber of Secrets,"Ignoring threats to his life, Harry returns to Hogwarts to investigate – aided by Ron and Hermione – a mysterious series of attacks.",29.741452,/sdEOH0992YZ0QSxgXNIGLq1ToUi.jpg,"[{'name': '1492 Pictures', 'id': 436}, {'name': 'Heyday films', 'id': 437}, {'name': 'Warner Bros.', 'id': 6194}]",2002-11-13,876688482.0,161.0,Released,Hogwarts is back in session.,Harry Potter and the Chamber of Secrets,7.4,5966.0,/wfnMt6LGqYHcNyOfsuusw5lX3bL.jpg
