belongs_to_collection,genres,id,imdb_id,original_language,original_title,overview,popularity,poster_path,production_companies,release_date,revenue,runtime,status,tagline,title,vote_average,vote_count,backdrop_path
"{'id': 9435, 'name': 'Babe Collection', 'poster_path': '/jgnah0k4AumfcZE4HHMJywYHvG6.jpg', 'backdrop_path': '/zRWuGdIlkWqXMQcs1t3sPy1XQ6x.jpg'}","[{'id': 14, 'name': 'Fantasy'}, {'id': 18, 'name': 'Drama'}, {'id': 35, 'name': 'Comedy'}, {'id': 10751, 'name': 'Family'}]",9598,tt0112431,en,Babe,"Babe is a little pig who doesn't quite know his place in the world. With a bunch of odd friends, like Ferdinand the duck who thinks he is a rooster and Fly the dog he calls mom, Babe realizes that he has the makings to become the greatest sheep pig of all time, and Farmer Hogget knows it. With the help of the sheep dogs Babe learns that a pig can be anything that he wants to be.",14.404764,/gN6X3fwPya8pLffk9OEWV3DqBnE.jpg,"[{'name': 'Universal Pictures', 'id': 33}, {'name': 'Kennedy Miller Productions', 'id': 2537}]",1995-07-18,254134910.0,89.0,Released,A little pig goes a long way.,Babe,6.0,756.0,/zRWuGdIlkWqXMQcs1t3sPy1XQ6x.jpg
"{'id': 123800, 'name': 'Before... Collection', 'poster_path': '/giaxAC74fht0LVQ4WKVoDzLM2Iy.jpg', 'backdrop_path': '/wtNugZq8ZzBYwPIh3VoNUJdkBWG.jpg'}","[{'id': 18, 'name': 'Drama'}, {'id': 10749, 'name': 'Romance'}]",76,tt0112471,en,Before Sunrise,"A dialogue marathon of a film, this fairytale love story of an American boy and French girl. During a day and a night together in Vienna their two hearts collide.",11.304979,/jsQy4ZbPHA8hE2O6QU05PpofI61.jpg,"[{'name': 'Detour Film Production', 'id': 98}, {'name': 'Warner Bros.', 'id': 6194}]",1995-01-27,5535405.0,105.0,Released,Can the greatest romance of your life last only one night?,Before Sunrise,7.7,984.0,/wtNugZq8ZzBYwPIh3VoNUJdkBWG.jpg
"{'id': 410261, 'name': 'A Goofy Movie Collection', 'poster_path': '/4AkuuP5ljZMsAhzVnpzIXPSmDoy.jpg', 'backdrop_path': '/yiLa63gIb7EGH9BbUWXHwI6PMmx.jpg'}","[{'id': 10749, 'name': 'Romance'}, {'id': 16, 'name': 'Animation'}, {'id': 10751, 'name': 'Family'}, {'id': 35, 'name': 'Comedy'}, {'id': 12, 'name': 'Adventure'}]",15789,tt0113198,en,A Goofy Movie,"Though Goofy always means well, his amiable cluelessness and klutzy pratfalls regularly embarrass his awkward adolescent son, Max. When Max's lighthearted prank on his high-school principal finally gets his longtime crush, Roxanne, to notice him, he asks her on a date. Max's trouble at school convinces Goofy that he and the boy need to bond over a cross-country fishing trip like the one he took with his dad when he was Max's age, which throws a kink in his son's plans to impress Roxanne.",10.177977,/bycmMhO3iIoEDzP768sUjq2RV4T.jpg,"[{'name': 'Walt Disney Pictures', 'id': 2}]",1995-04-07,35348597.0,78.0,Released,It's the story of a father who couldn't be closer...to driving his son crazy.,A Goofy Movie,6.7,404.0,/yiLa63gIb7EGH9BbUWXHwI6PMmx.jpg
"{'id': 217704, 'name': 'The Vampire Chronicles', 'poster_path': '/1Iop0dywqQeD5Mm7oRVR8vZ8gkj.jpg', 'backdrop_path': '/5margBoJC97ZrciVpAUc0PiY6Rc.jpg'}","[{'id': 27, 'name': 'Horror'}, {'id': 10749, 'name': 'Romance'}]",628,tt0110148,en,Interview with the Vampire,"A vampire relates his epic life story of love, betrayal, loneliness, and dark hunger to an over-curious reporter.",11.970205,/hldXwwViSfHJS0kIJr07KBGmHJI.jpg,"[{'name': 'Geffen Pictures', 'id': 360}]",1994-11-11,223664608.0,123.0,Released,Drink from me and live forever,Interview with the Vampire,7.2,1558.0,/5margBoJC97ZrciVpAUc0PiY6Rc.jpg
"{'id': 115142, 'name': 'Tales from the Crypt Collection', 'poster_path': '/mjP1Ktqz3VCyX2akRAIjgxaALwx.jpg', 'backdrop_path': '/o9Nll2BovcZ9EDmBBMmnHx99wP4.jpg'}","[{'id': 27, 'name': 'Horror'}, {'id': 35, 'name': 'Comedy'}, {'id': 53, 'name': 'Thriller'}]",9059,tt0114608,en,Tales from the Crypt: Demon Knight,A man on the run is hunted by a demon known as the Collector.,9.455342,/8uD5yk0ECebJ59lhvhTBKhUojc.jpg,"[{'name': 'Universal Pictures', 'id': 33}, {'name': 'Tales From The Crypt Holdings', 'id': 69626}]",1995-01-13,0.0,92.0,Released,Ready for your deadtime story?,Tales from the Crypt: Demon Knight,6.7,96.0,/o9Nll2BovcZ9EDmBBMmnHx99wP4.jpg
"{'id': 3167, 'name': 'Ace Ventura Collection', 'poster_path': '/qCxH543pScFed1CycwJ1nVgrkOc.jpg', 'backdrop_path': '/bswWgdDsLu0fhWMYUzLF8XgiK4h.jpg'}","[{'id': 35, 'name': 'Comedy'}, {'id': 9648, 'name': 'Mystery'}]",3049,tt0109040,en,Ace Ventura: Pet Detective,"He's Ace Ventura: Pet Detective. Jim Carrey is on the case to find the Miami Dolphins' missing mascot and quarterback Dan Marino. He goes eyeball to eyeball with a man-eating shark, stakes out the Miami Dolphins and woos and wows the ladies. Whether he's undercover, under fire or underwater, he always gets his man . . . or beast!",11.247957,/nZirljb8XYbKTWsRQTplDGhx39Q.jpg,"[{'name': 'Warner Bros.', 'id': 6194}, {'name': 'Morgan Creek Productions', 'id': 10210}]",1994-02-04,107217396.0,86.0,Released,"He's the best there is! (Actually, he's the only one there is.)",Ace Ventura: Pet Detective,6.4,1684.0,/bswWgdDsLu0fhWMYUzLF8XgiK4h.jpg
"{'id': 11716, 'name': 'Addams Family Collection', 'poster_path': '/iqAjYCir8x2fc8eeQ2k4qZqOMP1.jpg', 'backdrop_path': '/gS5yZLrSJ6uNbsz17xoxf70X2Ws.jpg'}","[{'id': 35, 'name': 'Comedy'}, {'id': 10751, 'name': 'Family'}, {'id': 14, 'name': 'Fantasy'}]",2758,tt0106220,en,Addams Family Values,"Siblings Wednesday and Pugsley Addams will stop at nothing to get rid of Pubert, the new baby boy adored by parents Gomez and Morticia. Things go from bad to worse when the new ""black widow"" nanny, Debbie Jellinsky, launches her plan to add Fester to her collection of dead husbands.",17.555909,/zEwEXGDvJ8Ou2s6XbLMPvMTX53S.jpg,"[{'name': 'Paramount Pictures', 'id': 4}, {'name': 'Orion Pictures', 'id': 41}, {'name': 'Scott Rudin Productions', 'id': 258}]",1993-11-19,48919043.0,94.0,Released,The Family Just Got A Little Stranger,Addams Family Values,6.5,537.0,/gS5yZLrSJ6uNbsz17xoxf70X2Ws.jpg
"{'id': 150156, 'name': 'City Slickers Collection', 'poster_path': '/1xHwbqIfBQvxNCkdJwQ5vxFwI5H.jpg', 'backdrop_path': '/qv2Bcy963o42k65v0km97G1ceZ4.jpg'}","[{'id': 28, 'name': 'Action'}, {'id': 35, 'name': 'Comedy'}, {'id': 18, 'name': 'Drama'}, {'id': 37, 'name': 'Western'}]",11310,tt0109439,en,City Slickers II: The Legend of Curly's Gold,"On Mitch Robbins 40th birthday begins quite well until he returns home and finds his brother Glen, the black sheep of the family, in his sofa. Nevertheless he is about to have a wonderful birthday-night with his wife when he discovers a treasure map of Curly by chance. Together with Phil and unfortunately with Glen he tries to find the hidden gold of Curly's father in the desert of Arizona.",8.605703,/gh0lsyJARglhpbKmnY8i8M7V5bI.jpg,"[{'name': 'Columbia Pictures', 'id': 5}, {'name': 'Castle Rock Entertainment', 'id': 97}]",1994-06-10,0.0,116.0,Released,,City Slickers II: The Legend of Curly's Gold,4.9,103.0,/qv2Bcy963o42k65v0km97G1ceZ4.jpg
"{'id': 52988, 'name': 'Hot Shots! Collection', 'poster_path': '/5uzldxeEVqvdaZhE4uCT9TTz9p1.jpg', 'backdrop_path': '/iGrRouADMV9MbidImsgRORaV3q.jpg'}","[{'id': 28, 'name': 'Action'}, {'id': 35, 'name': 'Comedy'}, {'id': 10752, 'name': 'War'}]",9255,tt0107144,en,Hot Shots! Part Deux,"Topper Harley is found to be working as an odd-job-man in a monastery. The CIA want him to lead a rescue mission into Iraq, to rescue the last rescue team, who went in to rescue the last rescue team who... who went in to rescue hostages left behind after Desert Storm.",13.482371,/oOXt9gmvsbnoNAx6s202GDTirfw.jpg,"[{'name': 'Twentieth Century Fox Film Corporation', 'id': 306}, {'name': 'Sidley Wright & Associates', 'id': 11751}]",1993-05-21,133752825.0,86.0,Released,Just deux it.,Hot Shots! Part Deux,6.2,463.0,/iGrRouADMV9MbidImsgRORaV3q.jpg
"{'id': 328, 'name': 'Jurassic Park Collection', 'poster_path': '/qIm2nHXLpBBdMxi8dvfrnDkBUDh.jpg', 'backdrop_path': '/pJjIH9QN0OkHFV9eue6XfRVnPkr.jpg'}","[{'id': 12, 'name': 'Adventure'}, {'id': 878, 'name': 'Science Fiction'}]",329,tt0107290,en,Jurassic Park,"A wealthy entrepreneur secretly creates a theme park featuring living dinosaurs drawn from prehistoric DNA. Before opening day, he invites a team of experts and his two eager grandchildren to experience the park and help calm anxious investors. However, the park is anything but amusing as the security systems go off-line and the dinosaurs escape.",8.863776,/c414cDeQ9b6qLPLeKmiJuLDUREJ.jpg,"[{'name': 'Universal Pictures', 'id': 33}, {'name': 'Amblin Entertainment', 'id': 56}]",1993-06-11,920100000.0,127.0,Released,An adventure 65 million years in the making.,Jurassic Park,7.6,4956.0,/pJjIH9QN0OkHFV9eue6XfRVnPkr.jpg
"{'id': 105075, 'name': 'The Shadow Collection', 'poster_path': '/s3ymS1GDfSYmMKmIdCBMc0fbVni.jpg', 'backdrop_path': '/ntIfzZNGz2aHRumYM7P8vqLJv6W.jpg'}","[{'id': 12, 'name': 'Adventure'}, {'id': 14, 'name': 'Fantasy'}, {'id': 28, 'name': 'Action'}, {'id': 53, 'name': 'Thriller'}, {'id': 878, 'name': 'Science Fiction'}]",8850,tt0111143,en,The Shadow,"Based on the 1930's comic strip, puts the hero up against his arch enemy, Shiwan Khan, who plans to take over the world by holding a city to ransom using an atom bomb. Using his powers of invisibility and ""The power to cloud men's minds"", the Shadow comes blazing to the city's rescue with explosive results.",7.881107,/uk2DdXqdGiFfF5PrvvadQHKES1o.jpg,"[{'name': 'Universal Pictures', 'id': 33}]",1994-07-01,48063435.0,108.0,Released,The Shadow Knows!,The Shadow,5.4,140.0,/ntIfzZNGz2aHRumYM7P8vqLJv6W.jpg
"{'id': 422837, 'name': 'Blade Runner Collection', 'poster_path': '/foT46aJ7QPUFDl3CK8ArDl0JaZX.jpg', 'backdrop_path': '/57zhlMYblPute6qb8v16ZmGSPVv.jpg'}","[{'id': 878, 'name': 'Science Fiction'}, {'id': 18, 'name': 'Drama'}, {'id': 53, 'name': 'Thriller'}]",78,tt0083658,en,Blade Runner,"In the smog-choked dystopian Los Angeles of 2019, blade runner Rick Deckard is called out of retirement to terminate a quartet of replicants who have escaped to Earth seeking their creator for a way to extend their short life spans.",96.272374,/p64TtbZGCElxQHpAMWmDHkWJlH2.jpg,"[{'name': 'Shaw Brothers', 'id': 5798}, {'name': 'Warner Bros.', 'id': 6194}, {'name': 'The Ladd Company', 'id': 7965}]",1982-06-25,33139618.0,117.0,Released,Man has made his match... now it's his problem.,Blade Runner,7.9,3833.0,/57zhlMYblPute6qb8v16ZmGSPVv.jpg
"{'id': 9888, 'name': 'Home Alone Collection', 'poster_path': '/zYPsleQJo1n1rBPlecJBRb3iwSO.jpg', 'backdrop_path': '/cYS2aWxECESUN2OS3JiLrKMmOko.jpg'}","[{'id': 35, 'name': 'Comedy'}, {'id': 10751, 'name': 'Family'}]",771,tt0099785,en,Home Alone,"Eight-year-old Kevin McCallister makes the most of the situation after his family unwittingly leaves him behind when they go on Christmas vacation. But when a pair of bungling burglars set their sights on Kevin's house, the plucky kid stands ready to defend his territory. By planting booby traps galore, adorably mischievous Kevin stands his ground as his frantic mother attempts to race home before.",0.702543,/8IWPBT1rkAaI8Kpk5V3WfQRklJ7.jpg,"[{'name': 'Twentieth Century Fox Film Corporation', 'id': 306}, {'name': 'Hughes Entertainment', 'id': 477}]",1990-11-09,476684675.0,103.0,Released,A Family Comedy Without the Family.,Home Alone,7.1,2487.0,/cYS2aWxECESUN2OS3JiLrKMmOko.jpg
"{'id': 528, 'name': 'The Terminator Collection', 'poster_path': '/vxiKtcxAJxHhlg2H1X8y7zcM3k6.jpg', 'backdrop_path': '/cpmbkwSxZnKO69V82A9a34tvk2E.jpg'}","[{'id': 28, 'name': 'Action'}, {'id': 53, 'name': 'Thriller'}, {'id': 878, 'name': 'Science Fiction'}]",280,tt0103064,en,Terminator 2: Judgment Day,"Nearly 10 years have passed since Sarah Connor was targeted for termination by a cyborg from the future. Now her son, John, the future leader of the resistance, is the target for a newer, more deadly terminator. Once again, the resistance has managed to send a protector back to attempt to save John and his mother Sarah.",22.661695,/2y4dmgWYRMYXdD1UyJVcn2HSd1D.jpg,"[{'name': 'Lightstorm Entertainment', 'id': 574}, {'name': 'Pacific Western', 'id': 1280}, {'name': 'Canal+', 'id': 5358}, {'name': 'Carolco Pictures', 'id': 14723}, {'name': 'T2 Productions', 'id': 61409}]",1991-07-01,520000000.0,137.0,Released,It's nothing personal.,Terminator 2: Judgment Day,7.7,4274.0,/cpmbkwSxZnKO69V82A9a34tvk2E.jpg
"{'id': 153010, 'name': 'Beauty and the Beast Collection', 'poster_path': '/mIzZxNAT1GIFaEoPYdJsUKC23Oj.jpg', 'backdrop_path': '/obOhJ6VC1IGvlxQYLp1KmjrTbt5.jpg'}","[{'id': 10749, 'name': 'Romance'}, {'id': 10751, 'name': 'Family'}, {'id': 16, 'name': 'Animation'}, {'id': 14, 'name': 'Fantasy'}, {'id': 10402, 'name': 'Music'}]",10020,tt0101414,en,Beauty and the Beast,"Follow the adventures of Belle, a bright young woman who finds herself in the castle of a prince who's been turned into a mysterious beast. With the help of the castle's enchanted staff, Belle soon learns the most important lesson of all -- that true beauty comes from within.",23.433511,/b9QJr2oblOu1grgOMUZF1xkUJdh.jpg,"[{'name': 'Walt Disney Pictures', 'id': 2}, {'name': 'Walt Disney Animation Studios', 'id': 6125}, {'name': 'Silver Screen Partners IV', 'id': 10282}]",1991-11-13,377350553.0,84.0,Released,The most beautiful love story ever told.,Beauty and the Beast,7.5,3029.0,/obOhJ6VC1IGvlxQYLp1KmjrTbt5.jpg
"{'id': 116661, 'name': 'The Arrival Collection', 'poster_path': '/oBBLM2XzrBwjmwWRsPmZ4UuBe7g.jpg', 'backdrop_path': '/rEk9ZLfrYXL87CMEddMaYAOwC39.jpg'}","[{'id': 28, 'name': 'Action'}, {'id': 9648, 'name': 'Mystery'}, {'id': 878, 'name': 'Science Fiction'}, {'id': 53, 'name': 'Thriller'}]",10547,tt0115571,en,The Arrival,"Zane Ziminski is an astrophysicist who receives a message that seems to have extraterrestrial origins. Eerily soon after his discovery, Zane is fired. He then embarks on a search to determine the origins of the transmission that leads him into a Hitchcockian labyrinth of paranoia and intrigue.",6.497591,/7K7NExClVGDQMaHzj7gwx4mcJ40.jpg,"[{'name': 'Live Entertainment', 'id': 285}, {'name': 'Steelwork Films', 'id': 12450}, {'name': 'Mediaworks', 'id': 12451}]",1996-05-31,14048372.0,115.0,Released,The greatest danger facing our world has been the planet's best kept secret... until now.,The Arrival,6.1,200.0,/rEk9ZLfrYXL87CMEddMaYAOwC39.jpg
"{'id': 115838, 'name': 'Escape From ... Collection', 'poster_path': '/8Zih8QGPJNXUuws0fIZmjxjs2Su.jpg', 'backdrop_path': '/c9mWaF2oeodriDLqYQr425sasxo.jpg'}","[{'id': 28, 'name': 'Action'}, {'id': 12, 'name': 'Adventure'}, {'id': 878, 'name': 'Science Fiction'}, {'id': 53, 'name': 'Thriller'}]",10061,tt0116225,en,Escape from L.A.,"This time, a cataclysmic temblor hits Los Angeles, turning it into an island. The president views the quake as a sign from above, expels Los Angeles from the country and makes it a penal colony for those found guilty of moral crimes. When his daughter, part of a resistance movement, steals the control unit for a doomsday weapon, Snake again gets tapped to save the day.",12.229381,/rAjz6XFC6Zs07oraJSnajbaAbG9.jpg,"[{'name': 'Paramount Pictures', 'id': 4}, {'name': 'Rysher Entertainment', 'id': 11661}]",1996-08-09,42277365.0,97.0,Released,Snake Is Back.,Escape from L.A.,5.6,381.0,/c9mWaF2oeodriDLqYQr425sasxo.jpg
"{'id': 230, 'name': 'The Godfather Collection', 'poster_path': '/7SJVjEDoo7xH62TS8stkqRk4Byo.jpg', 'backdrop_path': '/3WZTxpgscsmoUk81TuECXdFOD0R.jpg'}","[{'id': 18, 'name': 'Drama'}, {'id': 80, 'name': 'Crime'}]",238,tt0068646,en,The Godfather,"Spanning the years 1945 to 1955, a chronicle of the fictional Italian-American Corleone crime family. When organized crime family patriarch, Vito Corleone barely survives an attempt on his life, his youngest son, Michael steps in to take care of the would-be killers, launching a campaign of bloody revenge.",41.109264,/rPdtLWNsZmAtoZl9PK7S2wE3qiS.jpg,"[{'name': 'Paramount Pictures', 'id': 4}, {'name': 'Alfran Productions', 'id': 10211}]",1972-03-14,245066411.0,175.0,Released,An offer you can't refuse.,The Godfather,8.5,6024.0,/3WZTxpgscsmoUk81TuECXdFOD0R.jpg
"{'id': 115225, 'name': 'Children of the Corn Collection', 'poster_path': '/v6auJblMcNxUmZx23mQXMHmzyY3.jpg', 'backdrop_path': '/g4aK8Up5zSegesJdMYbxDcndn20.jpg'}","[{'id': 27, 'name': 'Horror'}]",25750,tt0115885,en,Children of the Corn IV: The Gathering,"Grace Rhodes, who is studying to be a doctor, returns to her hometown as a strange illness is afflicting the local children. The symptoms include a high fever and spasms, but even weirder is what happens the next day: All those with the illness claim they are somebody else -- then they begin murdering the grown-ups. After her sister undergoes the same sinister metamorphosis, Grace comes to believe there is some connection to an evil cult figure who may be returning from the grave.",7.97048,/tRjeV9AZgCXGTqyvlp7Ui55Yb3l.jpg,"[{'name': 'Dimension Films', 'id': 7405}]",1996-10-08,0.0,85.0,Released,In a sleepy midwestern town... A horrifying evil is about to rise again!,Children of the Corn IV: The Gathering,4.6,41.0,/g4aK8Up5zSegesJdMYbxDcndn20.jpg
"{'id': 119674, 'name': 'Psycho Collection', 'poster_path': '/29pDqAgmb4idzWzuZncoT7LZplA.jpg', 'backdrop_path': '/bPQZkZjNnsYuPZWzoRRl9k0VSQ8.jpg'}","[{'id': 18, 'name': 'Drama'}, {'id': 27, 'name': 'Horror'}, {'id': 53, 'name': 'Thriller'}]",539,tt0054215,en,Psycho,"When larcenous real estate clerk Marion Crane goes on the lam with a wad of cash and hopes of starting a new life, she ends up at the notorious Bates Motel, where manager Norman Bates cares for his housebound mother. The place seems quirky, but fine… until Marion decides to take a shower.",36.826309,/81d8oyEFgj7FlxJqSDXWr8JH8kV.jpg,"[{'name': 'Paramount Pictures', 'id': 4}, {'name': 'Universal Pictures', 'id': 33}, {'name': 'Shamley Productions', 'id': 10717}]",1960-06-16,32000000.0,109.0,Released,The master of suspense moves his cameras into the icy blackness of the unexplored!,Psycho,8.3,2405.0,/bPQZkZjNnsYuPZWzoRRl9k0VSQ8.jpg
"{'id': 55427, 'name': 'Fantasia Collection', 'poster_path': '/qHpXVQVhSOXwFNFCfKfdTnuyrXl.jpg', 'backdrop_path': '/7YanwpylLB3yzhwzf11W1tYpcQF.jpg'}","[{'id': 16, 'name': 'Animation'}, {'id': 10751, 'name': 'Family'}, {'id': 10402, 'name': 'Music'}]",756,tt0032455,en,Fantasia,"Walt Disney's timeless masterpiece is an extravaganza of sight and sound! See the music come to life, hear the pictures burst into song and experience the excitement that is Fantasia over and over again.",8.03796,/dYZ1r3MJnXVGBBSYKgpd8UWGyFw.jpg,"[{'name': 'Walt Disney Pictures', 'id': 2}]",1940-11-13,83320000.0,124.0,Released,The most sensational sound you'll ever see!,Fantasia,7.2,831.0,/7YanwpylLB3yzhwzf11W1tYpcQF.jpg
"{'id': 397842, 'name': 'The Amityville Horror Collection', 'poster_path': '/8uCu7d43IHPwFfNS2qCyVuRP1cP.jpg', 'backdrop_path': '/kPfuozrsE7pmFFolkR0xFicZDJT.jpg'}","[{'id': 27, 'name': 'Horror'}]",33519,tt0106262,en,Amityville: A New Generation,"When young photographer Keyes (Ross Partridge) snaps a picture of a mysterious homeless man the subject insists he take a dark yet strangely beautiful antique mirror. Back at Keyes' home, the demonic forces of the infamous Long Island horror-house find new life through the mirror's frightening reflections. As unsuspecting victims gaze into the shimmering glass, they witness the",6.401828,/k38YBT6yg22NziWVOT7p1ULLzQ9.jpg,"[{'name': 'A. Ninety-Three Productions', 'id': 36394}]",1993-09-29,0.0,90.0,Released,Terror Has a Reflection All its Own.,Amityville: A New Generation,2.8,17.0,/kPfuozrsE7pmFFolkR0xFicZDJT.jpg
"{'id': 151, 'name': 'Star Trek: The Original Series Collection', 'poster_path': '/zcB8KxHA4EapOoZZPAvwgmE1iGK.jpg', 'backdrop_path': '/9BQj9hq0aK6yM9Tm2NJ28jg572y.jpg'}","[{'id': 878, 'name': 'Science Fiction'}, {'id': 12, 'name': 'Adventure'}, {'id': 9648, 'name': 'Mystery'}]",152,tt0079945,en,Star Trek: The Motion Picture,"When a destructive space entity is spotted approaching Earth, Admiral Kirk resumes command of the Starship Enterprise in order to intercept, examine, and hopefully stop it.",8.277765,/ys5Sgpc27mVo3H5zYLPV9LWDq5.jpg,"[{'name': 'Paramount Pictures', 'id': 4}]",1979-12-06,139000000.0,132.0,Released,The human adventure is just beginning.,Star Trek: The Motion Picture,6.2,541.0,/9BQj9hq0aK6yM9Tm2NJ28jg572y.jpg
"{'id': 151, 'name': 'Star Trek: The Original Series Collection', 'poster_path': '/zcB8KxHA4EapOoZZPAvwgmE1iGK.jpg', 'backdrop_path': '/9BQj9hq0aK6yM9Tm2NJ28jg572y.jpg'}","[{'id': 878, 'name': 'Science Fiction'}, {'id': 28, 'name': 'Action'}, {'id': 12, 'name': 'Adventure'}, {'id': 53, 'name': 'Thriller'}]",172,tt0098382,en,Star Trek V: The Final Frontier,Capt. Kirk and his crew must deal with Mr. Spock's half brother who kidnaps three diplomats and hijacks the Enterprise in his obsessive search for God.,12.308007,/kugwPq2E5IkzrgoxRycnoqqUS9H.jpg,"[{'name': 'Paramount Pictures', 'id': 4}]",1989-06-09,70200000.0,107.0,Released,Adventure and imagination will meet at the final frontier.,Star Trek V: The Final Frontier,5.6,384.0,/9BQj9hq0aK6yM9Tm2NJ28jg572y.jpg
"{'id': 151, 'name': 'Star Trek: The Original Series Collection', 'poster_path': '/zcB8KxHA4EapOoZZPAvwgmE1iGK.jpg', 'backdrop_path': '/9BQj9hq0aK6yM9Tm2NJ28jg572y.jpg'}","[{'id': 28, 'name': 'Action'}, {'id': 12, 'name': 'Adventure'}, {'id': 878, 'name': 'Science Fiction'}, {'id': 53, 'name': 'Thriller'}]",154,tt0084726,en,Star Trek II: The Wrath of Khan,Admiral James T. Kirk is feeling old; the prospect of accompanying his old ship the Enterprise on a two week cadet cruise is not making him feel any younger. But the training cruise becomes a a life or death struggle when Khan escapes from years of exile and captures the power of creation itself.,7.160236,/7VKpj4Xl3hTzgAS3xpVuOyqNnSv.jpg,"[{'name': 'Paramount Pictures', 'id': 4}]",1982-06-03,96800000.0,113.0,Released,At the end of the universe lies the beginning of vengeance.,Star Trek II: The Wrath of Khan,7.3,688.0,/9BQj9hq0aK6yM9Tm2NJ28jg572y.jpg
"{'id': 86083, 'name': 'Grease Collection', 'poster_path': '/rYy6EBjcCh9jwcfxhyUZFLFiG84.jpg', 'backdrop_path': '/95ASlSlkBSILVLrZA69P0OdniP5.jpg'}","[{'id': 35, 'name': 'Comedy'}, {'id': 18, 'name': 'Drama'}, {'id': 10751, 'name': 'Family'}, {'id': 10402, 'name': 'Music'}, {'id': 10749, 'name': 'Romance'}]",9037,tt0084021,en,Grease 2,"It's 1961, two years after the original Grease gang graduated, and there's a new crop of seniors and new members of the coolest cliques on campus, the Pink Ladies and T-Birds. Michael Carrington is the new kid in school - but he's been branded a brainiac. Can he fix up an old motorcycle, don a leather jacket, avoid a rumble with the leader of the T-Birds, and win the heart of Pink Lady Stephanie?",14.202364,/lTjDMtgfXb2bUrg80h2lJbvJMwW.jpg,"[{'name': 'Paramount Pictures', 'id': 4}]",1982-06-11,15171476.0,115.0,Released,The Music and Feeling go on Forever.,Grease 2,4.9,185.0,/95ASlSlkBSILVLrZA69P0OdniP5.jpg
"{'id': 97445, 'name': 'Air Bud Collection', 'poster_path': '/6uJ2GXA5kBskJx6emTuHyp2S3ww.jpg', 'backdrop_path': '/3iROV2GdrAFz6lbrGneQLt8lc7K.jpg'}","[{'id': 35, 'name': 'Comedy'}, {'id': 10751, 'name': 'Family'}, {'id': 18, 'name': 'Drama'}]",20737,tt0118570,en,Air Bud,"A young boy and a talented stray dog with an amazing basketball playing ability become instant friends. Rebounding from his father's accidental death, 12-year-old Josh Framm moves with his family to the small town of Fernfield, Washington. The new kid in town, Josh has no friends and is too shy to try out for the school basketball team. Instead he prefers to practice alone on an abandoned court, he befriends a runaway golden retriever named Buddy. Josh is amazed when he realizes that Buddy loves basketball...that is playing basketball...and he is GOOD! Josh eventually makes the school team and Buddy is named the Team Mascot. Josh and Buddy become the stars of halftime. Buddy's half-time talent draws media attention. Unfortunately, when Buddy's mean former owner, Norm Snively, comes along with a scheme to cash in on the pup's celebrity, it looks like they are going to be separated.",9.407128,/ny0lBB66RdnhIkfzsqpLl2suQaY.jpg,"[{'name': 'Walt Disney Pictures', 'id': 2}]",1997-08-01,23144499.0,98.0,Released,He Sits. He Stays. He Shoots. He Scores.,Air Bud,5.3,108.0,/3iROV2GdrAFz6lbrGneQLt8lc7K.jpg
"{'id': 135489, 'name': 'Wishmaster Collection', 'poster_path': '/7nOdiSiu1b5AuNlXNuq73nLq6i6.jpg', 'backdrop_path': '/yCTkIUEOwc7HAGAoZGK85MK8dAd.jpg'}","[{'id': 27, 'name': 'Horror'}]",10351,tt0120524,en,Wishmaster,"The Djinn having been released from his ancient prison seeks to capture the soul of the woman who discovered him, thereby opening a portal and freeing his fellow Djinn to take over the earth.",5.215107,/t7rep7SCqiy4COUsq2cOcdQwzU0.jpg,"[{'name': 'Live Entertainment', 'id': 285}, {'name': 'Image Organization', 'id': 21084}, {'name': 'Pierre David', 'id': 24075}]",1997-09-19,15719109.0,90.0,Released,Be careful what you wish for.,Wishmaster,5.6,114.0,/yCTkIUEOwc7HAGAoZGK85MK8dAd.jpg
"{'id': 103372, 'name': 'Mr. Bean Collection', 'poster_path': '/61Jcc1Gwc2KE7sIJ1HPqqdt67ji.jpg', 'backdrop_path': '/aIXcqHz5VKRLXHPsNo0dFoK7YP5.jpg'}","[{'id': 35, 'name': 'Comedy'}]",1281,tt0118689,en,Bean,"Bean works as a caretaker at Britain's formidable Royal National Gallery, and his bosses want to fire him because he sleeps at work all the time, but can't because the chairman of the gallery's board defends him. They send him to USA, to the small Los Angeles art gallery instead, where he'll have to officiate at the opening of the greatest US picture ever (called ""Whistler's Mother"").",12.799853,/pKGGzotqkNDEL2ix4VU1bWmteK5.jpg,"[{'name': 'Tiger Aspect Productions', 'id': 686}, {'name': 'PolyGram Filmed Entertainment', 'id': 1382}, {'name': 'Working Title Films', 'id': 10163}]",1997-07-03,251212670.0,85.0,Released,One Man. One Masterpiece. One Very Big Mistake.,Bean,6.3,602.0,/aIXcqHz5VKRLXHPsNo0dFoK7YP5.jpg
