belongs_to_collection,genres,id,imdb_id,original_language,original_title,overview,popularity,poster_path,production_companies,release_date,revenue,runtime,status,tagline,title,vote_average,vote_count,backdrop_path
"{'id': 123724, 'name': 'Dracula (Hammer Series)', 'poster_path': '/n5SozLvdQZ7cYJb22ZIwNw1DzSg.jpg', 'backdrop_path': '/hybYYwBqaomfePU3uaiJfpg7ykC.jpg'}","[{'id': 27, 'name': 'Horror'}]",33020,tt0068505,en,Dracula A.D. 1972,"Set in London in the early 1970's, supposedly for teen thrills, Johnny organises a black magic ceremony in a desolate churchyard. The culmination of the ritual, however, is the rejuvenation of Dracula from shrivelled remains. Johnny, Dracula' s disciple, lures victims to the deserted graveyard for his master's pleasure and one of the victims delivered is Jessica Van Helsing. Descended from the Van Helsing line of vampire hunters her grandfather, equipped with all the devices to snare and destroy the Count, confronts his arch enemy in the age-old battle between good and evil.",11.174533,/9H9wjdGUfJYEV88gPc7kre3gNlv.jpg,"[{'name': 'Hammer Film Productions', 'id': 1314}]",1972-09-27,0.0,96.0,Released,"The Count is back, with an eye for London's hotpants . . . and a taste for everything",Dracula A.D. 1972,6.0,30.0,/hybYYwBqaomfePU3uaiJfpg7ykC.jpg
"{'id': 155474, 'name': 'French Connection Collection', 'poster_path': '/zheN2WhCSS1M8rkjObQGr0dZdvZ.jpg', 'backdrop_path': '/islbdTICsxPE1c3YEFzEc9Wb46p.jpg'}","[{'id': 28, 'name': 'Action'}, {'id': 80, 'name': 'Crime'}, {'id': 18, 'name': 'Drama'}, {'id': 53, 'name': 'Thriller'}]",10711,tt0073018,en,French Connection II,"""Popeye"" Doyle travels to Marsailles to find Alain Charnier, the drug smuggler that eluded him in New York.",18.54199,/mef0hcVIOQfDUubjdTwvuafO1dj.jpg,"[{'name': 'Twentieth Century Fox Film Corporation', 'id': 306}]",1975-05-18,12484444.0,119.0,Released,,French Connection II,6.6,95.0,/islbdTICsxPE1c3YEFzEc9Wb46p.jpg
"{'id': 10721, 'name': 'Mimic Collection', 'poster_path': '/oKG4cGU0hw6ONVyjrS2qECQinrg.jpg', 'backdrop_path': '/AmlJVxC6M1BfZgpgtuBoTg1Jwqq.jpg'}","[{'id': 27, 'name': 'Horror'}, {'id': 878, 'name': 'Science Fiction'}, {'id': 53, 'name': 'Thriller'}]",10706,tt0239641,en,Mimic 2,"When a cockroach-spread plague threatened to decimate the child population of New York City in the original Mimic, biologist Susan Tyler and her research associates developed a species of ""Judas"" bugs and introduced them into the environment, where they were to ""mimic"" the diseased roaches and infiltrate their grubby habitats. The plan worked until the bugs evolved to mimic their next prey.....humans! Just when they were all thought to be dead, the giant cockroaches are back, and this time they've mutated to take on human form!",4.88911,/13tSI83ucR7XuQcr7muAjNIgH91.jpg,"[{'name': 'Neo Art & Logic', 'id': 2811}, {'name': 'Dimension Films', 'id': 7405}]",2001-07-17,0.0,82.0,Released,Nothing will stop them...,Mimic 2,4.8,54.0,/AmlJVxC6M1BfZgpgtuBoTg1Jwqq.jpg
"{'id': 308645, 'name': 'The Foreigner Collection', 'poster_path': '/cH5oS9LNPPnGJAKNR4p57Phn3n2.jpg', 'backdrop_path': '/2L4Vz9eVwVUufqQcDYmlkHSx5ep.jpg'}","[{'id': 28, 'name': 'Action'}, {'id': 53, 'name': 'Thriller'}]",18248,tt0312700,en,The Foreigner,This story is about a freelance agent (Seagal) who is the courier of a package from France to Germany. He soon finds that many people want to get their hands on it.,4.266051,/esfi6vzwvq5M6H5OisFvG58mSvt.jpg,"[{'name': 'Columbia Pictures', 'id': 5}, {'name': 'Franchise Pictures', 'id': 1403}]",2003-06-01,0.0,96.0,Released,"If they think they can stop him, they're dead wrong.",The Foreigner,3.7,41.0,/2L4Vz9eVwVUufqQcDYmlkHSx5ep.jpg
"{'id': 91698, 'name': 'Chili Palmer Collection', 'poster_path': '/ae3smJDdWrMJ77tDpYOrpo4frKq.jpg', 'backdrop_path': '/uWaANGQeoSs5vSP1CWtlkDrkqei.jpg'}","[{'id': 35, 'name': 'Comedy'}, {'id': 80, 'name': 'Crime'}]",4551,tt0377471,en,Be Cool,"Disenchanted with the movie industry, Chili Palmer tries the music industry, meeting and romancing a widow of a music exec on the way.",13.314233,/ekKCH7Zkb5ZTr1f1AczZY23FH.jpg,"[{'name': 'Double Feature Films', 'id': 215}, {'name': 'Jersey Films', 'id': 216}, {'name': 'Nina Saxon Film Design', 'id': 1693}, {'name': 'Metro-Goldwyn-Mayer (MGM)', 'id': 8411}]",2005-03-04,95226116.0,118.0,Released,Everyone is looking for the next big hit,Be Cool,5.4,296.0,/uWaANGQeoSs5vSP1CWtlkDrkqei.jpg
"{'id': 124879, 'name': 'State Property Collection', 'poster_path': '/s2gFwqbVFUT4K2qQD1DqGGMtvQr.jpg', 'backdrop_path': '/1j6VjTofmRXC31XP1vYFfxilhLN.jpg'}","[{'id': 28, 'name': 'Action'}, {'id': 12, 'name': 'Adventure'}, {'id': 80, 'name': 'Crime'}, {'id': 18, 'name': 'Drama'}]",13409,tt0403537,en,State Property 2,Three gangsters vie for control of the streets of Philadelphia.,0.318108,/96wJq8zxtCaBTFZbw3lGlrqzTMI.jpg,[],2005-04-13,1691706.0,94.0,Released,,State Property 2,5.5,3.0,/1j6VjTofmRXC31XP1vYFfxilhLN.jpg
"{'id': 52785, 'name': 'xXx Collection', 'poster_path': '/omRo1Pw4phlELRgYOQ7RyAlccLt.jpg', 'backdrop_path': '/g9Q2dmbxd1F2hHB5VslPbqGM1JV.jpg'}","[{'id': 28, 'name': 'Action'}, {'id': 12, 'name': 'Adventure'}, {'id': 80, 'name': 'Crime'}, {'id': 18, 'name': 'Drama'}, {'id': 9648, 'name': 'Mystery'}, {'id': 53, 'name': 'Thriller'}]",11679,tt0329774,en,xXx: State of the Union,"Ice Cube stars as Darius Stone, a thrill-seeking troublemaker whose criminal record and extreme sports obsession make him the perfect candidate to be the newest XXX agent. He must save the U.S. government from a deadly conspiracy led by five-star general and Secretary of Defense George Deckert (played by Willem Dafoe).",19.144611,/sNnciVEuolaZoIzn5v2rP0pjiL0.jpg,"[{'name': 'Original Film', 'id': 333}, {'name': 'Columbia Pictures Corporation', 'id': 441}, {'name': 'Revolution Studios', 'id': 497}]",2005-04-27,71073932.0,101.0,Released,Prepare for the next level,xXx: State of the Union,4.7,565.0,/g9Q2dmbxd1F2hHB5VslPbqGM1JV.jpg
"{'id': 12263, 'name': 'The Exorcist Collection', 'poster_path': '/wjMqwHkOuDBSOY5MujL5GSdlBTk.jpg', 'backdrop_path': '/gZnEheMdhKxSZQUEzphCHXldud1.jpg'}","[{'id': 27, 'name': 'Horror'}, {'id': 53, 'name': 'Thriller'}]",12700,tt0449086,en,Dominion: Prequel to the Exorcist,"Having lived through traumatizing events during WWII, Father Lankester Merrin takes a sabbatical from the Church to conduct archaeological excavations in British-administered East Africa. Merrin unearths an ancient Byzantine church believed have been built and then immediately buried to keep down evil from the crypt below. The natives are convinced that uncovering the church has unleashed a demon, and begin to violently clash with the British military troops. As the village rapidly disintegrates into chaos and war, a disabled and terribly injured local boy befriends Merrin and his condition begins to radically and implausibly improve. Is it a miracle from God, or something more sinister?",7.892677,/3jIQOCB8ghrxvfWzSjzNv41LR9P.jpg,"[{'name': 'Morgan Creek Productions', 'id': 10210}]",2005-05-20,251495.0,117.0,Released,"Go back before the beginning, to the place where evil was born.",Dominion: Prequel to the Exorcist,4.8,77.0,/gZnEheMdhKxSZQUEzphCHXldud1.jpg
"{'id': 1241, 'name': 'Harry Potter Collection', 'poster_path': '/8Xmkc1HvCOpMlbFvVabrtr6HAsp.jpg', 'backdrop_path': '/wfnMt6LGqYHcNyOfsuusw5lX3bL.jpg'}","[{'id': 12, 'name': 'Adventure'}, {'id': 14, 'name': 'Fantasy'}, {'id': 10751, 'name': 'Family'}]",674,tt0330373,en,Harry Potter and the Goblet of Fire,"Harry starts his fourth year at Hogwarts, competes in the treacherous Triwizard Tournament and faces the evil Lord Voldemort. Ron and Hermione help Harry manage the pressure – but Voldemort lurks, awaiting his chance to destroy Harry and all that he stands for.",24.903058,/6sASqcdrEHXxUhA3nFpjrRecPD2.jpg,"[{'name': 'Patalex IV Productions Limited', 'id': 462}, {'name': 'Warner Bros.', 'id': 6194}, {'name': 'Heyday Films', 'id': 7364}]",2005-11-05,895921036.0,157.0,Released,Dark And Difficult Times Lie Ahead.,Harry Potter and the Goblet of Fire,7.5,5758.0,/wfnMt6LGqYHcNyOfsuusw5lX3bL.jpg
"{'id': 8864, 'name': 'Final Destination Collection', 'poster_path': '/mZUyhsfIthTl5rfdeSox702Ircr.jpg', 'backdrop_path': '/y3aWOInifbGKXM34KjtcMITrZRZ.jpg'}","[{'id': 27, 'name': 'Horror'}, {'id': 9648, 'name': 'Mystery'}]",9286,tt0414982,en,Final Destination 3,"A student's premonition of a deadly rollercoaster ride saves her life and a lucky few, but not from death itself – which seeks out those who escaped their fate.",11.872997,/p7ARuNKUGPGvkBiDtIDvAzYzonX.jpg,"[{'name': 'New Line Cinema', 'id': 12}, {'name': 'Zide-Perry Productions', 'id': 3169}, {'name': 'Kumar Mobiliengesellschaft mbH & Co. Projekt Nr. 1 KG', 'id': 12067}, {'name': 'Hard Eight Pictures', 'id': 48772}, {'name': 'Matinee Pictures', 'id': 48785}, {'name': 'Practical Pictures', 'id': 48788}]",2006-02-10,117719158.0,93.0,Released,This Ride Will Be The Death Of You.,Final Destination 3,5.8,1000.0,/y3aWOInifbGKXM34KjtcMITrZRZ.jpg
"{'id': 19285, 'name': 'Leprechaun Collection (Original Series)', 'poster_path': '/kdnaM7K8T8oXwWk2QdiWEs8Zg2w.jpg', 'backdrop_path': '/pRjYboGyfjO5PkY7Rdg21s4FhoI.jpg'}","[{'id': 35, 'name': 'Comedy'}, {'id': 14, 'name': 'Fantasy'}, {'id': 27, 'name': 'Horror'}]",19286,tt0113636,en,Leprechaun 3,"It was a normal night in Las Vegas, Nevada, all the lights were flashing brightly, until a man with one hand, one eye, and one leg walks into a pawn shop with a statue of a hideous looking Leprechaun. The owner claims it's a good luck charm. The statue also wore a medallion around it's neck. The careless pawn shop owner took off the medallion setting the Leprechaun free...",8.21698,/kteSBXogCezbg3FN1HOB3tzD1gP.jpg,"[{'name': 'Trimark Pictures', 'id': 4063}]",1995-07-04,0.0,90.0,Released,Welcome to Vegas... the odds are you won't leave alive!,Leprechaun 3,5.0,42.0,/pRjYboGyfjO5PkY7Rdg21s4FhoI.jpg
"{'id': 87253, 'name': 'High School Musical Collection', 'poster_path': '/dXIgM9sEWIkUfRH8GZUKHv1t5n.jpg', 'backdrop_path': '/t1mwGPJi3NkwMeyeUHr9zlQhlTo.jpg'}","[{'id': 35, 'name': 'Comedy'}, {'id': 18, 'name': 'Drama'}, {'id': 10751, 'name': 'Family'}, {'id': 10402, 'name': 'Music'}, {'id': 10770, 'name': 'TV Movie'}]",10947,tt0475293,en,High School Musical,"Troy (Zac Efron), the popular captain of the basketball team, and Gabriella (Vanessa Anne Hudgens), the brainy and beautiful member of the academic club, break all the rules of East High society when they secretly audition for the leads in the school's musical. As they reach for the stars and follow their dreams, everyone learns about acceptance, teamwork, and being yourself. And it's all set to fun tunes and very cool dance moves!",10.187478,/lkcc7eC4qTbhE2DBnoVpGg2ZeM9.jpg,"[{'name': 'Disney Channel', 'id': 3213}]",2006-01-20,0.0,98.0,Released,This School Rocks Like No Other!,High School Musical,6.1,1048.0,/t1mwGPJi3NkwMeyeUHr9zlQhlTo.jpg
"{'id': 10721, 'name': 'Mimic Collection', 'poster_path': '/oKG4cGU0hw6ONVyjrS2qECQinrg.jpg', 'backdrop_path': '/AmlJVxC6M1BfZgpgtuBoTg1Jwqq.jpg'}","[{'id': 27, 'name': 'Horror'}, {'id': 878, 'name': 'Science Fiction'}, {'id': 53, 'name': 'Thriller'}]",33005,tt0330634,en,Mimic: Sentinel,"A man enclosed in a plastic bubble, his sister, and their best friend must defend an apartment complex from the mutant Judas Breed insects.",2.803406,/vNAwfgBPZXprxfgx7cF5Cji4be1.jpg,"[{'name': 'Neo Art & Logic', 'id': 2811}, {'name': 'Dimension Films', 'id': 7405}]",2003-04-14,0.0,77.0,Released,,Mimic: Sentinel,4.8,36.0,/AmlJVxC6M1BfZgpgtuBoTg1Jwqq.jpg
"{'id': 86092, 'name': 'Step Up Collection', 'poster_path': '/f4KxUp5IL5sgoDzFUL9GoUfy01C.jpg', 'backdrop_path': '/3jr0rQcsWyfqBlmzE0h0igjJohS.jpg'}","[{'id': 10402, 'name': 'Music'}, {'id': 18, 'name': 'Drama'}, {'id': 10749, 'name': 'Romance'}, {'id': 80, 'name': 'Crime'}]",9762,tt0462590,en,Step Up,"Everyone deserves a chance to follow their dreams, but some people only get one shot. Tyler Gage is a rebel from the wrong side of Baltimore's tracks and the only thing that stands between him and an unfulfilled life are his dreams of one day making it out of there. Nora is a privileged ballet dancer attending Baltimore's ultra-elite Maryland School of the Arts",14.21769,/uy1kUNtvYTZLkBSpQP8FQMRdAg7.jpg,"[{'name': 'Summit Entertainment', 'id': 491}, {'name': 'Offspring Entertainment', 'id': 2378}, {'name': 'Touchstone Pictures', 'id': 9195}, {'name': 'Eketahuna LLC', 'id': 74192}]",2006-08-11,114194847.0,104.0,Released,Every Second Chance Begins With a First Step,Step Up,6.7,1092.0,/3jr0rQcsWyfqBlmzE0h0igjJohS.jpg
"{'id': 221539, 'name': 'Dracula (Universal Series)', 'poster_path': '/srgkikGqQD32mhaq8wT6Qz2eLcD.jpg', 'backdrop_path': '/sdbStuQ5qEPZqqWUlNlBd0dPtBT.jpg'}","[{'id': 18, 'name': 'Drama'}, {'id': 14, 'name': 'Fantasy'}, {'id': 27, 'name': 'Horror'}]",22440,tt0027545,en,Dracula's Daughter,A countess from Transylvania seeks a psychiatrist’s help to cure her vampiric cravings.,2.076008,/pEHxABVS2iBkvhInc2gEu2utctI.jpg,"[{'name': 'Universal Pictures', 'id': 33}]",1936-05-11,0.0,71.0,Released,She gives you that WEIRD FEELING,Dracula's Daughter,6.3,24.0,/sdbStuQ5qEPZqqWUlNlBd0dPtBT.jpg
"{'id': 9743, 'name': 'The Hannibal Lecter Anthology', 'poster_path': '/aRbyr3KsdmIczGh6VrlvlgQdwMQ.jpg', 'backdrop_path': '/npCbvak9UhjPsZB9Oa2k2jsqI7E.jpg'}","[{'id': 80, 'name': 'Crime'}, {'id': 18, 'name': 'Drama'}, {'id': 53, 'name': 'Thriller'}]",1248,tt0367959,en,Hannibal Rising,"The story of the early, murderous roots of the cannibalistic killer, Hannibal Lecter – from his hard-scrabble Lithuanian childhood, where he witnesses the repulsive lengths to which hungry soldiers will go to satiate themselves, through his sojourn in France, where as a med student he hones his appetite for the kill.",2.159558,/k1QRG9qZzuuJe4JTTpe4jlnQ5tt.jpg,"[{'name': 'Ingenious Film Partners', 'id': 289}, {'name': 'ETIC Films', 'id': 2979}, {'name': 'Quinta Communications', 'id': 6370}, {'name': 'Dino De Laurentiis Company', 'id': 10308}, {'name': 'Zephyr Films', 'id': 16923}, {'name': 'Young Hannibal Productions', 'id': 20394}, {'name': 'Carthago Films S.a.r.l.', 'id': 20395}]",2007-02-06,82169884.0,121.0,Released,It started with revenge.,Hannibal Rising,6.0,666.0,/npCbvak9UhjPsZB9Oa2k2jsqI7E.jpg
"{'id': 103372, 'name': 'Mr. Bean Collection', 'poster_path': '/61Jcc1Gwc2KE7sIJ1HPqqdt67ji.jpg', 'backdrop_path': '/aIXcqHz5VKRLXHPsNo0dFoK7YP5.jpg'}","[{'id': 10751, 'name': 'Family'}, {'id': 35, 'name': 'Comedy'}]",1268,tt0453451,en,Mr. Bean's Holiday,"Mr. Bean wins a trip to Cannes where he unwittingly separates a young boy from his father and must help the two reunite. On the way he discovers France, bicycling and true love, among other things.",10.19853,/5G3gOZemcwXf2nbUFB4VCc5gl2A.jpg,"[{'name': 'Tiger Aspect Productions', 'id': 686}, {'name': 'Working Title Films', 'id': 10163}]",2007-03-22,229736344.0,90.0,Released,Disaster has a passport.,Mr. Bean's Holiday,6.1,682.0,/aIXcqHz5VKRLXHPsNo0dFoK7YP5.jpg
"{'id': 556, 'name': 'Spider-Man Collection', 'poster_path': '/aNknE3vw8QC5gDHBRYpOz9gzuPc.jpg', 'backdrop_path': '/waZqriYTuBE3WqXI3SDGi3kfDQE.jpg'}","[{'id': 14, 'name': 'Fantasy'}, {'id': 28, 'name': 'Action'}, {'id': 12, 'name': 'Adventure'}]",559,tt0413300,en,Spider-Man 3,"The seemingly invincible Spider-Man goes up against an all-new crop of villain – including the shape-shifting Sandman. While Spider-Man’s superpowers are altered by an alien organism, his alter ego, Peter Parker, deals with nemesis Eddie Brock and also gets caught up in a love triangle.",27.614265,/sqZKCRYGovZ8aN99VVJSdL8Ja9k.jpg,"[{'name': 'Columbia Pictures', 'id': 5}, {'name': 'Laura Ziskin Productions', 'id': 326}, {'name': 'Marvel Enterprises', 'id': 19551}]",2007-05-01,890871626.0,139.0,Released,The battle within.,Spider-Man 3,5.9,3687.0,/waZqriYTuBE3WqXI3SDGi3kfDQE.jpg
"{'id': 1565, 'name': '28 Days/Weeks Later Collection', 'poster_path': '/4AeGz1Jwnq6ky2kfLT95Tm8nEiw.jpg', 'backdrop_path': '/bpn1vynevsKLwAMRikY1L6cb18p.jpg'}","[{'id': 27, 'name': 'Horror'}, {'id': 53, 'name': 'Thriller'}, {'id': 878, 'name': 'Science Fiction'}]",1562,tt0463854,en,28 Weeks Later,"In this chilling sequel to 28 Days Later, the inhabitants of the British Isles appear to have lost their battle against the onslaught of disease, as the deadly rage virus has killed every citizen there. Six months later, a group of Americans dare to set foot on the isles, convinced the danger has come and gone. But it soon becomes all too clear that the scourge continues to live, waiting to pounce on its next victims.",12.884191,/kcJ99AtUykDhpzfQOApsViQa3fj.jpg,"[{'name': 'DNA Films', 'id': 284}, {'name': 'Figment Films', 'id': 359}, {'name': 'Sociedad General de Cine S.A.', 'id': 785}, {'name': 'UK Film Council', 'id': 2452}, {'name': 'Fox Atomic', 'id': 2890}, {'name': 'Koan Films', 'id': 10890}]",2007-04-26,64238440.0,100.0,Released,When days turn to weeks... the horror returns.,28 Weeks Later,6.5,1225.0,/bpn1vynevsKLwAMRikY1L6cb18p.jpg
"{'id': 110177, 'name': 'Goal! Collection', 'poster_path': '/jaUSrep1RTzr73QPN3DNkW4LiRn.jpg', 'backdrop_path': '/mKTYkGMseCEFXuZ4CjuZ00xXRCd.jpg'}","[{'id': 18, 'name': 'Drama'}]",9815,tt0473360,en,Goal! II: Living the Dream,"Tempted away from Newcastle United to join Real Madrid, rising star Santiago Munez finds this latest change of fortune the greatest challenge yet - personally as well as professionally. He is reunited with Gavin Harris, though they must compete to be on the team, and estranged from fiancee Roz, whose nursing career keeps her back home.",4.59233,/sKKej989oVbZahldAkrMVmyB8pU.jpg,"[{'name': 'Impala', 'id': 1183}]",2007-02-09,0.0,115.0,Released,,Goal! II: Living the Dream,5.8,147.0,/mKTYkGMseCEFXuZ4CjuZ00xXRCd.jpg
"{'id': 263, 'name': 'The Dark Knight Collection', 'poster_path': '/bqS2lMgGkuodIXtDILFWTSWDDpa.jpg', 'backdrop_path': '/xfKot7lqaiW4XpL5TtDlVBA9ei9.jpg'}","[{'id': 18, 'name': 'Drama'}, {'id': 28, 'name': 'Action'}, {'id': 80, 'name': 'Crime'}, {'id': 53, 'name': 'Thriller'}]",155,tt0468569,en,The Dark Knight,"Batman raises the stakes in his war on crime. With the help of Lt. Jim Gordon and District Attorney Harvey Dent, Batman sets out to dismantle the remaining criminal organizations that plague the streets. The partnership proves to be effective, but they soon find themselves prey to a reign of chaos unleashed by a rising criminal mastermind known to the terrified citizens of Gotham as the Joker.",123.167259,/1hRoyzDtpgMU7Dz4JF22RANzQO7.jpg,"[{'name': 'DC Comics', 'id': 429}, {'name': 'Legendary Pictures', 'id': 923}, {'name': 'Warner Bros.', 'id': 6194}, {'name': 'DC Entertainment', 'id': 9993}, {'name': 'Syncopy', 'id': 9996}]",2008-07-16,1004558444.0,152.0,Released,Why So Serious?,The Dark Knight,8.3,12269.0,/xfKot7lqaiW4XpL5TtDlVBA9ei9.jpg
"{'id': 363015, 'name': 'Frosty the Snowman Collection', 'poster_path': '/p4W9r7FaSs21P9I6PRjrl6qXrXY.jpg', 'backdrop_path': '/9C08pJcp2gBlHrjb8ArYNG18xX4.jpg'}","[{'id': 10751, 'name': 'Family'}, {'id': 16, 'name': 'Animation'}, {'id': 10770, 'name': 'TV Movie'}]",13675,tt0064349,en,Frosty the Snowman,"A discarded silk top-hat becomes the focus of a struggle between a washed-up stage magician and a group of schoolchildren, after it magically brings a snowman to life. Realizing that newly-living Frosty will melt in spring unless he takes refuge in a colder climate, Frosty and Karen, a young girl who he befriends, stow away on a freight train headed for the north pole. Little do they know that the magician is following them, and he wants his hat back!",4.305337,/11OatmlcIjhRyvKcSi96ccumoEp.jpg,"[{'name': 'Rankin/Bass Productions', 'id': 688}]",1969-12-07,0.0,25.0,Released,,Frosty the Snowman,6.7,72.0,/9C08pJcp2gBlHrjb8ArYNG18xX4.jpg
"{'id': 87253, 'name': 'High School Musical Collection', 'poster_path': '/dXIgM9sEWIkUfRH8GZUKHv1t5n.jpg', 'backdrop_path': '/t1mwGPJi3NkwMeyeUHr9zlQhlTo.jpg'}","[{'id': 35, 'name': 'Comedy'}, {'id': 18, 'name': 'Drama'}, {'id': 10751, 'name': 'Family'}, {'id': 10402, 'name': 'Music'}]",13649,tt0810900,en,High School Musical 2,"The East High Wildcats are ready to have the time of their lives. Troy (Zac Efron) is thrilled when he’s offered a job in a country club, but it’s all part of Sharpay’s (Ashley Tisdale) plot to lure him away from Gabriella (Vanessa Hudgens). How will it all turn out? All questions are answered on the night of the club’s Talent Show.",6.529094,/oZ0u3CLAdSzJWAVXsHhGqzmCiNG.jpg,"[{'name': 'Disney Channel', 'id': 3213}]",2007-08-17,7000000.0,104.0,Released,,High School Musical 2,6.1,884.0,/t1mwGPJi3NkwMeyeUHr9zlQhlTo.jpg
"{'id': 10441, 'name': 'Babylon 5 Collection', 'poster_path': '/4SmQl6eoFuyvHPj1noqqKf93yK6.jpg', 'backdrop_path': '/mpiKaJZSIDVGbuKxL1KyQPxeW6Y.jpg'}","[{'id': 878, 'name': 'Science Fiction'}, {'id': 12, 'name': 'Adventure'}, {'id': 28, 'name': 'Action'}]",16068,tt0280453,en,Babylon 5: The Legend of the Rangers - To Live and Die in Starlight,"After being punished for retreat from combat, Ranger David Martel is given command of the Liandra, a haunted 20-year old Minbari fighting ship. He's escorting ambassadors to a secret archaeological site, the oldest city on record and a clue to a dangerous ancient race.",2.698788,/bIhOn8xKsOQGjiNCQ8sKoQyYmNa.jpg,"[{'name': 'Babylonian Productions', 'id': 2181}, {'name': 'Sci-Fi Channel', 'id': 5856}, {'name': 'Legendary Films Inc.', 'id': 25191}]",2002-01-19,0.0,90.0,Released,,Babylon 5: The Legend of the Rangers - To Live and Die in Starlight,5.9,27.0,/mpiKaJZSIDVGbuKxL1KyQPxeW6Y.jpg
"{'id': 10893, 'name': 'Critters Collection', 'poster_path': '/rWZytVHeFsADHeuoPCIf4c7Qepb.jpg', 'backdrop_path': '/9K0ycQWRv4vSL1oM8y7dOXwFpy6.jpg'}","[{'id': 35, 'name': 'Comedy'}, {'id': 27, 'name': 'Horror'}, {'id': 878, 'name': 'Science Fiction'}, {'id': 53, 'name': 'Thriller'}]",12525,tt0101628,en,Critters 4,"Just before bounty hunter Charile triggers his gun to destroy the last two Critter-eggs, he gets a message that it would be illegal to extinguish the race from the galaxy. He's sent a transporter where he puts the eggs - unfortunately the transporter takes him with it and then gets lost in space.",8.537871,/w7AnAlh5wyR0ItcSg7CeFHDYONW.jpg,"[{'name': 'New Line Cinema', 'id': 12}, {'name': 'OH Films', 'id': 66755}]",1992-08-20,0.0,100.0,Released,In Space... They love to hear you scream,Critters 4,4.3,46.0,/9K0ycQWRv4vSL1oM8y7dOXwFpy6.jpg
"{'id': 86774, 'name': 'Che Collection', 'poster_path': '/dnUuLNFFQnoyKUjx3YtkKhaLlfE.jpg', 'backdrop_path': '/9WEBVDt9wj5sal9LnzWXwNtSEqP.jpg'}","[{'id': 18, 'name': 'Drama'}, {'id': 36, 'name': 'History'}, {'id': 10752, 'name': 'War'}]",8881,tt0892255,en,Che: Part One,"The Argentine, begins as Che and a band of Cuban exiles (led by Fidel Castro) reach the Cuban shore from Mexico in 1956. Within two years, they mobilized popular support and an army and toppled the U.S.-friendly regime of dictator Fulgencio Batista.",5.68041,/uhUGBtg7GwHQfm6ITdNZms4fTZI.jpg,"[{'name': 'Wild Bunch', 'id': 856}, {'name': 'Telecinco', 'id': 1182}, {'name': 'Laura Bickford Productions', 'id': 5163}, {'name': 'Morena Films', 'id': 10031}, {'name': 'Ministerio de Cultura', 'id': 11408}, {'name': 'Guerrilla Films', 'id': 11411}, {'name': 'Section Eight Productions', 'id': 14315}]",2008-09-05,0.0,134.0,Released,The revolution made him a legend.,Che: Part One,6.8,209.0,/9WEBVDt9wj5sal9LnzWXwNtSEqP.jpg
"{'id': 174218, 'name': 'The Howling Collection', 'poster_path': '/ci6CZhFFLm0r3fDomXlRAmCEesr.jpg', 'backdrop_path': '/a0UuiTYxqMmj5Ll26rORaFoTKBc.jpg'}","[{'id': 27, 'name': 'Horror'}]",35945,tt0097534,en,Howling V: The Rebirth,"When a group of people from different walks of life converge in a Hungarian castle situated in Budapest which has been sealed for 500 years, they bring with them a werewolf which slowly begins to cut their numbers down.",0.187499,/44CC72slmP6rPplS438pOPsewik.jpg,[],1989-01-01,0.0,96.0,Released,,Howling V: The Rebirth,3.9,20.0,/a0UuiTYxqMmj5Ll26rORaFoTKBc.jpg
"{'id': 9485, 'name': 'The Fast and the Furious Collection', 'poster_path': '/mCkqJf4ijbNoBWvJ0RTWZJuhJUA.jpg', 'backdrop_path': '/z5A5W3WYJc3UVEWljSGwdjDgQ0j.jpg'}","[{'id': 28, 'name': 'Action'}, {'id': 80, 'name': 'Crime'}, {'id': 18, 'name': 'Drama'}, {'id': 53, 'name': 'Thriller'}]",13804,tt1013752,en,Fast & Furious,"When a crime brings them back to L.A., fugitive ex-con Dom Toretto reignites his feud with agent Brian O'Conner. But as they are forced to confront a shared enemy, Dom and Brian must give in to an uncertain new trust if they hope to outmaneuver him. And the two men will find the best way to get revenge: push the limits of what's possible behind the wheel.",1.498902,/ft8IqAGFs3V7i87z0t0EVRUjK1p.jpg,"[{'name': 'Universal Pictures', 'id': 33}, {'name': 'Original Film', 'id': 333}, {'name': 'One Race Productions', 'id': 1225}, {'name': 'Dentsu Inc.', 'id': 1778}, {'name': 'Relativity Media', 'id': 7295}]",2009-04-02,363164265.0,107.0,Released,New Model. Original Parts.,Fast & Furious,6.5,2426.0,/z5A5W3WYJc3UVEWljSGwdjDgQ0j.jpg
